Question Name,Question,Option A,Option B,Option C,Option D,Answer,Explanation
Question 627,"4. A horizontal heated plate at 200 degree Celsius and facing upwards has been placed in still air at 20 degree Celsius. If the plate measures 1.25 m by 1 m, make calculations for the heat loss by natural convection. The convective film coefficient for free convection is given by the following empirical relation",h = 0.32 (_) 0.25 W/m2 K,Where _ is the mean film temperature in degrees kelvin,a) 6006 W,b) 5006 W,a,"Explanation: _ = 273 + 200 + 20/2 = 383 degree Celsius. Therefore, rate of heat loss = h A d t = 3006 W. "
Question 628,"5. For laminar flow, Reynolds number must not be less than",a) 1000,b) 2000,c) 20000,d) 40000,d,Explanation: It should not be less than 40000. 
Question 629,"6. For laminar flow, Prandtl number must be more than",a) 0.05,b) 0.2,c) 0.6,d) 0.3,c,Explanation: It must be more than 0.6. It is indicative of the relative ability of the fluid to diffuse momentum and internal energy by molecular mechanisms.
Question 630,7. Air at atmospheric pressure and 20 degree Celsius flows with 6 m/s velocity through main trunck duct of air conditioning system. The duct is rectangular in cross-section and measures 40 cm by 80 cm. Determine heat loss per meter length of duct corresponding to unit temperature difference. The relevant thermos-physical properties of air are,v = 15 * 10 -6 m 2/s,_ = 7.7 * 10 -2 m2/hr,k = 0.026 W/m degree,a) 32.768 W,b,"Explanation: Q = h A d t, Area = 2 (a + b) (1) = 2.4 m2, h = 365.34 k/l. "
Question 631,8. The local film coefficient for laminar flow past a flat plate may be obtained from the correlation,a) Nu = 0.332 (Re) 0.5 (Pr) 0.33,b) Nu = 0.332 (Re) 0.5 (Pr) 0.43,c) Nu = 0.332 (Re) 0.5 (Pr) 0.53,d) Nu = 0.332 (Re) 0.5 (Pr) 0.63,a,Explanation: Fluid properties are evaluated at mean film temperature. 
Question 632,"9. For a plate of length l, an average value of Nusselt number is given by",a) Nu = 0.664 (Re) 0.5 (Pr) 0.54,b) Nu = 0.664 (Re) 0.5 (Pr) 0.74,c) Nu = 0.664 (Re) 0.5 (Pr) 0.27,d) Nu = 0.664 (Re) 0.5 (Pr) 0.33,d,"Explanation: For a plate of length l, an average value of Nusselt number or convection coefficient may be obtained by integration. "
Question 633,10. The correlation for liquid metal is given by,a) Nu = 0.465 (Re) (Pr),b) Nu = 0.565 (Re) (Pr),c) Nu = 0.665 (Re) (Pr),d) Nu = 0.765 (Re) (Pr),b,Explanation: It is valid for Pr less than or equal to 0.05. 
Question 634,1. Which of the following is true for turbulent flow?,a) G r P r > 108,b) G r P r > 109,c) G r P r > 103,d) G r P r > 1015,b,"Explanation: The product G r P r is often referred to as Rayleigh number, and its value sets the criterion of turbulent character of flow. "
Question 635,2. Mc Adam relation is given by,a) Nu = 0.023 (Re) 0.8 (Pr) 0.4,b) Nu = 0.023 (Re) 0.8 (Pr) 0.3,c) Nu = 0.023 (Re) 0.8 (Pr) 0.2,d) Nu = 0.023 (Re) 0.8 (Pr) 0.1,a,"Explanation: Here, n = 0.4 if the fluid is being heated. "
Question 636,3. Investigate the effect of following condition on the average value of heat transfer coefficient in flow through a tube,Two fold increases in flow velocity by varying mass flow rate,"It may be presumed that there is no change in the temperature of the liquid and the tube wall, and that the flow through the tube is turbulent in character",a) 64.1% decrease,b) 64.1% increase,d,Explanation: h 2/h 1 = (V 2/V 1) 0.8 = .0741 = 74.1% 
Question 637,"4. Consider the above problem for two fold increase in the diameter of the tube, the flow velocity is maintained constant by change in the rate of liquid flow",a) 15%,b) 14%,c) 13%,d) 12%,c,Explanation: h 2/h 1 = (d 1/d 2) 0.2. 
Question 638,"5. Calculate the rate of heat loss from a human body which may be considered as a vertical cylinder 30 cm in diameter, and 175 cm high while standing in a 30 km/hr wind at 15 degree Celsius. Human has a surface temperature of 35 degree Celsius",a) 588.86 W,b) 688.86 W,c) 788.86 W,d) 888.86 W,b,"Explanation: Q = h A d t, h = Nu k/d. "
Question 639,6. A heat treat steel plate measures 3 m by 1 m and is initially at 30 degree Celsius. It is cooled by blowing air parallel to 1 m edge at 9 km/hr. If the air is at 10 degree Celsius. Estimate the convection heat transfer from both sides of the plate,a) 477.7 W,b) 547.7 W,c) 647.7 W,d) 747.6 W,d,"Explanation: Q = h A d t, h = Nu k/d. "
Question 640,"7. Consider the above problem, find the value of Reynolds number",a) 166003,b) 177003,c) 188003,d) 199003,a,Explanation: Re = p V l/µ = 16603 
Question 641,"8. The oil pan of 1.6 engine approximates a flat plate 0.3 m wide by 0.45 m long and protrudes below the framework of the automobile. The engine oil is at 95 degree Celsius and the ambient air temperature is 35 degree Celsius. If the automobile runs at 36 km/hr, make calculations for the rate of heat transfer from the oil-pan surface. Assume negligible resistance to conduction through the oil pan",a) 190.37 W,b) 180.37 W,c) 170.37 W,d) 160.37 W,c,"Explanation: Q = h A d t, where h = (Nu) (k)/l and Nu = 0.664 (Re) 0.5 (Pr).33. "
Question 642,"9. Air flows through a 10 cm internal diameter tube at the rate of 75 kg/hr. Measurements indicate that at a particular point in the tube, the pressure and temperature of air are 1.5 bar and 325 K whilst the tube wall temperature is 375 K. Find heat transfer rate from one meter length in the region of this point",The general non-dimensional correlation for turbulent flow in the tube is,Nu = 0.023 (Re) 0.8 (Pr) 0.4,Where the fluid properties are evaluated at the bulk temperature,a) 147.35 W,d,"Explanation: Q = h A d t, where h = (Nu) (k)/l = 177.35 W."
Question 643,"10. Consider the above problem, find the value of Nusselt number",a) 40.46,b) 50.56,c) 60.66,d) 70.76,a,Explanation: Nu = 0.023 (Re) 0.8 (Pr) 0.4 = 40.46. 
Question 644,1. Boiling refers to a change from the,a) Solid to a liquid phase,b) Vapor to a liquid phase,c) Liquid to a solid phase,d) Liquid to a vapor phase,d,Explanation: Boiling is a convective heat transfer process that is associated with a change in the phase of a fluid. 
Question 645,2. The boiling process has wide-spread applications in,(i) Production of steam in nuclear and steam power plants for generation and for industrial processes and space heating,(ii) Absorption of heat in refrigeration and air-conditioning systems,"(iii) Concentration, dehydration and drying of foods and materials",Identify the correct statements,c,Explanation: Boiling constitutes the convective heat transfer process that involves a phase change from liquid to vapor state. 
Question 646,3. Maximum heat transfer rate in a modern boiler is about,a) 2 * 10 5 W/m2,b) 3 * 10 5 W/m2,c) 4 * 10 5 W/m2,d) 5 * 10 5 W/m2,a,Explanation: Greater importance has recently been given to the boiling heat transfer. 
Question 647,4. Which type of boiling occurs in steam boilers employing natural convection?,a) Forced convection,b) Pool,c) Local,d) Saturated,b,Explanation: The liquid above the hot surface is essentially stagnant and the only motion near the surface is because of free convection. 
Question 648,5. In which type of boiling the fluid motion is induced by external means?,a) Pool,b) Local,c) Forced convection,d) Subcooled,c,Explanation: The liquid is pumped and forced across the surface in a controlled manner. 
Question 649,6. The temperature of the liquid is below the saturation temperature and boiling takes place only in vicinity of the heated surface. This type of boiling is known as,a) Subcooled,b) Forces,c) Saturated,d) Pool,a,"Explanation: The vapor bubbles travel a short path and then vanish, apparently they condense in the bulk of the liquid which is at a temperature less than the boiling point. "
Question 650,7. In which type of boiling the temperature of the liquid exceeds the saturation temperature?,a) Forced,b) Saturated,c) Pool,d) Saturated,d,Explanation: The vapor bubbles generated at the solid surface are transported through the liquid by buoyancy effects and eventually escape from the surface. 
Question 651,8. The phenomenon of stable film boiling is referred to as,a) Nucleate effect,b) Boiling regimes,c) Leiden frost effect,d) Von karma effect,c,Explanation: This is the region of stable film boiling. 
Question 652,"9. For water evaporating at atmospheric pressure, the burnout occurs at temperature excess slightly above",a) 25 K,b) 55 K,c) 75 K,d) 105 K,b,Explanation: The burnout point on the boiling curve represents the point of maximum heat flux at which transition occurs from nucleate to film boiling.
Question 653,10. The boiling phenomenon is known to occur in how many forms?,a) 1,b) 2,c) 3,d) 4,d,"Explanation: Pool, forced convection, subcooled and saturated boiling. "
Question 654,1. The bubble diameter at the time of detachment from the surface can be worked out from the relation proposed by,a) Stanton,b) Fritz,c) Fourier,d) Nusselt,b,"Explanation: It is given by Fritz, an American scientist. "
Question 655,2. The nucleate pool boiling is influenced by the following factors,(1) Pressure,(2) Liquid properties,(3) Material,Identify the correct statements,a,"Explanation: It depends on pressure, material and liquid properties. "
Question 656,3. Consider the following phenomena,(i) Boiling,(ii) Free convection in air,(iii) Forced convection in air,(iv) Conduction in air,d,Explanation: Heat transfer coefficient is maximum for conduction in air and is least for boiling. 
Question 657,4. The bubble diameter at the time of detachment from the surface can be worked out from the relation proposed by Fritz and is given by,a) C d _ [2 _/g (p t – p v)].,b) C d _ [2 _/g (p t – p v)] 3/2,c) C d _ [2 _/g (p t – p v)] 1/2,d) C d _ [2 _/g (p t – p v)] 5/2,c,Explanation: The constant C d has the value 0.0148 for water bubbles. 
Question 658,"5. In spite of large heat transfer coefficient in boiling liquids, fins are used advantageously when the entire surface is exposed to",a) Film boiling,b) Transition boiling,c) Nucleate boiling,d) All modes of boiling,d,"Explanation: Here all modes of boiling i.e. film, transition and nucleate are of great importance. "
Question 659,"6. With increase in excess temperature, the heat flux in boiling",a) Increases continuously,b) Decreases and then increases,"c) Decreases, then increases and again decreases","d) Increases, then decreases and again increases",d,Explanation: It first increases to 50% then decreases not to zero and again increases to its maximum value. 
Question 660,7. The excess temperature range 50 degree Celsius < d t < 200 degree Celsius is indicative of the region of,a) Interface evaporation,b) Nuclear boiling,c) Partial film boiling,d) Stable film boiling,c,Explanation: The physical phenomenon of pool boiling is generally divided into four different regions based on the excess temperature. 
Question 661,8. Heat flux increases with temperature excess beyond the Leiden-frost point due to,a) Radiation effect becomes predominant,b) Occurrence of subcooled boiling,c) Vapor space become large,d) Promotion of nucleate boiling,a,Explanation: Heat flux increases with temperature excess beyond the Leiden-frost point due to radiation effect becomes predominant. 
Question 662,9. Leiden-frost expansion is related to,a) Condensation of vapor on a cold surface,b) Exchange of heat between two solids,c) Evaporation of a solution,d) Boiling of liquid on a hot surface,d,Explanation: It is related to boiling of liquid on a hot surface. 
Question 663,10. Consider the following statements regarding nucleate boiling,(i) The temperature of the surface is greater than the saturation temperature of the liquid,(ii) Bubbles are created by the expansion of entrapped gas oil vapor at small cavities in the surface,(iii) The temperature is greater than that in film boiling,(iv) The heat transfer from the surface to the liquid is greater than that in the film boiling,b,Explanation: The temperature must be less than that in film boiling. 
Question 664,1. Reynolds number is replaced by a modulus significant of the agitation of the fluid particles in nucleate boiling. Such a dimensionless modulus is defined by the relation,a) Re b = 2 D b G b/_ f,b) Re b = D b G b/_ f,c) Re b = _ D b G b/_ f,d) Re b = 3 D b G b/_ f,b,"Explanation: This nucleate boiling regime is of great importance because of the very high heat fluxes possible with moderate temperature differences. Where, D b is the average bubble diameter, G b is the mass velocity of the bubble per unit area and _ f is the fluid viscosity."
Question 665,2. The bubble diameter has been expressed by Fritz as,a) D b = C d _ [2 _/g (p f – p g)] 1/2,b) D b = C d _ [2 _/g (p f – p g)] 3/2,c) D b = C d _ [2 _/g (p f – p g)] 5/2,d) D b = C d _ [2 _/g (p f – p g)] 7/2,a,"Explanation: C d is a constant which has been evaluated as 0.0148 for hydrogen and water bubbles. Where, C d is a constant, _ is surface tension of the liquid and _ is the bubble contact angle measured through liquid in degrees."
Question 666,3. What is the value of surface fluid constant for water-copper combination?,a) 0.010,b) 0.011,c) 0.012,d) 0.013,d,Explanation: The surface fluid regime is of great importance because of the very high heat fluxex possible with moderate temperature differences. 
Question 667,4. What is the value of surface fluid constant for water-brass combination?,a) 0.004,b) 0.005,c) 0.006,d) 0.007,c,"Explanation: For H 2 O and Brass combination, this value must lie between 0.0056 to 0.00062. "
Question 668,"5. Spherical bubbles of 3 mm diameter are observed in the bulk fluid boiling of water at standard atmospheric pressure. Assuming pure water vapor in the bubble and vapor pressure equal to 101.325 k N/m2, calculate the temperature of the vapor",a) 100.217 degree Celsius,b) 200.217 degree Celsius,c) 300.217 degree Celsius,d) 400.217 degree Celsius,a,Explanation: T v – T sat = (2 _/r – p g) R v T V2/p v h    f g. 
Question 669,"6. An electric wire of 1.25 mm diameter and 250 mm long is laid horizontally and submerged in water at 7 bar. The wire has an applied voltage of 2.2 V and carries a current of 130 amperes. If the surface of the wire is maintained at 200 degree Celsius, make calculations for the heat flux",a) 0.0915 * 10 6 W/m2,b) 0.1915 * 10 6 W/m2,c) 0.2915 * 10 6 W/m2,d) 0.3915 * 10 6 W/m2,c,Explanation: Q= V I = 286 W and A = 9.81 * 10 -4 m2. Therefore heat flux = Q/A. 
Question 670,"7. Consider the above problem, find the boiling heat transfer coefficient",a) 5330 W/m2 K,b) 6330 W/m2 K,c) 7330 W/m2 K,d) 8330 W/m2 K,d,"Explanation: Q = h A d t. So, h = 8330 W/m2 K. "
Question 671,8. Which of the following parameters affect burnout heat flux in the nucleate boiling region,(i) Heat of evaporation,(ii) Temperature difference,(iii) Density of vapor,(iv) Density of liquid,b,"Explanation: Acc to Zuber relation, burn out (Q/A) = 0.18 p g h f g [p (p f – p g)/p g 2]    0.25 [p f/p g + p f] 0.5. "
Question 672,"9. All the following statements are correct, except",a) Nucleate boiling gets promoted on a smooth surface,"b) In subcooled heating, the temperature of the heating surface is more than the boiling point of the liquid",c) Film boiling region is usually avoided in commercial equipment,d) There occurs transition from nucleate to film boiling burn-out point on the boiling curve,a,Explanation: A rough surface gives a better heat transmission than when the surface is either smooth or has been coated to weak its tendency to get wetted.
Question 673,10. Milk spills over when it is boiled in an open vessel. The boiling of milk at this instant is referred to as,a) Interface evaporation,b) Sub-cooled boiling,c) Film boiling,d) Saturated nucleate boiling,b,Explanation: This is an application of sub-cooled boiling. 
Question 674,"1. When evaporation takes place at the liquid-vapor interface, the heat transfer is solely due to free convection and the film coefficient follows the relation",a) Nu = f 1 (G r) f 2 (P r),b) Nu = 2 f 1 (G r) f 2 (P r),c) Nu = 3 f 1 (G r) f 2 (P r),d) Nu = 4 f 1 (G r) f 2 (P r),a,Explanation: The functions f 1 and f 2 depend upon the geometry of the heating surface. 
Question 675,2. Fritz criterion is given by,a) h = 1.973 (Q/A) 0.45,b) h = 1.973 (Q/A) 0.55,c) h = 1.973 (Q/A) 0.65,d) h = 1.973 (Q/A) 0.75,d,Explanation: Fritz formulated the following formula for water boiling at atmospheric pressure in free convection in a vertical tube headed from outside.
Question 676,3. A 0.10 cm diameter and 15 cm long wire has been laid horizontally and submerged in water at atmospheric pressure. The wire has a steady state voltage drop of 14.5 V and a current of 42.5 A. Determine the heat flux of the wire.,The following equation applies for water boiling on a horizontal submerged surface,H = 1.54 (Q/A) 0.75 = 5.58 (d t) 3 W/m2 K where Q/A is the heat flux rate in W/m2 and d t is the temperature difference between surface and saturation,a) 1.308 * 10 8 W/m2,b) 1.308 * 10 7 W/m2,c,Explanation: Q = E I = 616.25 W and A = 4.71 * 10 -4 m2. 
Question 677,"4. Consider the above problem, find the excess temperature of the wire",a) 18.01 degree Celsius,b) 19.01 degree Celsius,c) 20.01 degree Celsius,d) 21.01 degree Celsius,b,Explanation: 1.54 (1.308 * 10 6) 2 = 5.58 (d t) 3. 
Question 678,5. Natural convection heat transfer coefficients over surface of a vertical pipe and a vertical flat plate for same height. What is/are the possible reasons for this?,(i) Same height,(ii) Both vertical,(iii) Same fluid,(iv) Same fluid flow pattern,d,Explanation: The fluids must be same so their flow pattern. 
Question 679,6. The heat flux in nucleate boiling varies in accordance with,a) h f g,b) (h f g) 0.5,c) 1/(h f g) 2,d) (h f g) 3,c,Explanation: Q/A = _ f h f g [(p f – p g) g/_] 0.5 [C f d t/h f g p     C s f] 3. 
Question 680,"7. In nucleate pool boiling, the heat flux depends on","a) Liquid properties, material and condition of the surface",b) Material of the surface only,c) Material and roughness of the surface,d) Liquid properties and material of the surface,a,Explanation: The heat flux must depends on liquid properties material and condition of the surface. 
Question 681,8. Identify the wrong statement with respect to boiling heat transfer?,a) The steam boilers employing natural convection have steam raised through pool boiling,b) Boiling occurs when a heated surface is exposed to a liquid and maintained at a temperature lower than the saturation temperature of the liquid,c) Leiden-frost effect refers to the phenomenon of stable film boiling,d) The nucleation boiling is characterized by the formation of bubbles at the nucleation sites and the resulting liquid agitation,b,"Explanation: For boiling to occur, the heated surface must be exposed to a liquid and maintained at a temperature higher than the saturation temperature of the liquid. "
Question 682,9. Estimate the peak heat flux for water boiling at normal atmospheric pressure. The relevant thermo-physical properties are,p f (liquid) = 958.45 kg/m3,p g (vapor) = 0.61 kg/m3,h f g = 2.25 * 10 6 J/kg,_ = 0.0585 N/m,c,Explanation: (Q/A) = 0.18 p g h f g [_ (p f – p g)/p g 2] 0.25. 
Question 683,"10. A 1.0 mm diameter and 300 mm long nickel wire is submerged horizontal in water at atmospheric pressure. At burnout, the wire has a current of 195 A. Calculate the voltage at burnout. The relevant thermos-physical properties are",p f (fluid) = 959.52 kg/m3,p g (vapor) = 0.597 kg/m3,h f g = 2257000 J/kg,_ = 0.0533 N/m,b,Explanation: (Q/A) MAX = 1480000 W/m2. Let E b be the voltage at burnout. Then electric energy input to wire is E    b I = 195 E b W. 
Question 684,1. Condensation refers to a change from the,a) Solid to a liquid phase,b) Vapor to a liquid phase,c) Liquid to a solid phase,d) Liquid to a vapor phase,b,Explanation: Condensation is a convective heat transfer process that is associated with a change in the phase of a fluid.
Question 685,2. Condensation process is very common in,(i) Boilers,(ii) Condensers,(iii) Evaporators,Identify the correct statements,c,Explanation: This process is very common in power plants and refrigeration systems. 
Question 686,3. The convective coefficients for condensation usually lie in the range,a) 30-300 W/m2 K,b) 60-3000 W/m2 K,c) 300-10000 W/m2 K,d) 2500-10000 W/m2 K,d,Explanation: The convective coefficient for condensation should be high because condensation refers to a change from the vapor to a liquid phase. 
Question 687,4. Drop wise condensation usually occurs on,a) Oily surface,b) Glazed surface,c) Smooth surface,d) Coated surface,a,Explanation: It generally occurs on oily surface. It is the convective heat transfer process that is associated with a change in the phase of a fluid.
Question 688,5. Consider the following statements,"(i) If a condensing liquid does not wet a surface, then drop wise condensation will not take place on it",(ii) Drop wise condensation gives a higher transfer rate than film wise condensation,(iii) Reynolds number of condensing liquid is based on its mass flow rate,(iv) Suitable coating or vapor additive is used to promote film wise condensation,d,Explanation: All are correct except the last one because suitable coating or vapor additive is not used to promote film wise condensation. 
Question 689,"6. Depending upon the behavior of condensate up on the cooled surface, the condensation process are classified into how many distinct modes?",a) 1,b) 2,c) 3,d) 4,b,Explanation: Film condensation and drop wise condensation. 
Question 690,"7. A plate condenser was designed to be kept vertical. How would the condensation coefficient be effected if due to site constraints, it has to be kept at 60 degree to the horizontal?",a) 1.53% reduction in condensation coefficient,b) 2.53% reduction in condensation coefficient,c) 3.53% reduction in condensation coefficient,d) 4.53% reduction in condensation coefficient,c,"Explanation: h VER = 0.943 [k 3 p 2 g h f g/_ l (t sat – t s)] 0.25, h    INC = 0.943 [k 3 p 2 g sin _ h f g/_ l (t sat – t s)] 0.25. "
Question 691,8. Saturated steam is allowed to condense over a vertical flat surface and the condensate film flows down the surface. The local coefficient of heat transfer for condensation,a) Remains constant at all heights of the surface,b) Decreases with increasing distance from the top of the surface,c) Increases with increasing thickness of film,d) Increases with increasing temperature differential between the surface and vapour,b,Explanation: It decreases with increasing thickness of condensate film. 
Question 692,"9. In condensation over a vertical surface, the value of convection coefficient varies as",a) k 0.25,b) k 0.33,c) k 0.75,d) k -0.5,a,Explanation: h = 0.943 [k 3 p 2 g h f g/_ l (t sat – t s)] 0.25. 
Question 693,"10. For film wise condensation on a vertical plane, the film thickness _ and heat transfer coefficient h vary with distance x from the leading edge as","a) _ decreases, h increases",b) Both _ and h increases,"c) _ increases, h decreases",d) Both _ and h decreases,c,Explanation: Thickness increases and heat transfer coefficient decreases. 
Question 694,"1. For laminar film condensation on a vertical plate, the velocity distribution at a distance _ from the top edge is given by",a) p g (_ y – y/2)/_,b) p g (_ y – y 2)/_,c) p g (_ y – y 2/2)/_,d) p g (_ – y 2/2)/_,c,Explanation: An equation for the velocity distribution as a function of some distance from the wall surface can be set up by considering the equilibrium between the gravity and viscous forces on an elementary volume of the liquid film. 
Question 695,"2. For laminar film condensation on a vertical plate, the film thickness is given by",a) [4 k _ (t sat – t s) x/p 2 g h f g] 0.25,b) [4 k _ (t sat – t s) x/p 2 g h f g] 0.5,c) [4 k _ (t sat – t s) x/p 2 g h f g] ,d) [4 k _ (t sat – t s) x/p 2 g h f g] 1.5,a,Explanation: The film thickness increases as the fourth root of the distance down the surface. 
Question 696,"3. For laminar film condensation on a vertical plate, the mass flow rate of the condensate per unit depth of the film at any position x is given by",a) p g _ 3/ 3,b) p g _ 3/ 3 _,c) p g _ 2/ 3 _,d) p g _ 2/ 3,b,Explanation: Mass flow rate = mean flow velocity * flow area * density. 
Question 697,"4. For laminar film condensation on a vertical plate, the gravitational acceleration g is replaced by",a) 4 g sin _,b) 3 g sin _,c) 2 g sin _,d) g sin _,d,"Explanation: It is replaced by sin _. Where, _ is the inclination angle with the horizontal."
Question 698,"5. For laminar film condensation on a vertical plate, the local heat transfer coefficient at the lower edge of the plate is given by",a) [k 3 p 2 g h f g /4 _ l (t sat – t s)] 0.25,b) [k 3 p 2 g h f g /4 _ l (t sat – t s)] 0.5,c) [k 3 p 2 g h f g /4 _ l (t sat – t s)] 0.1,d) [k 3 p 2 g h f g /4 _ l (t sat – t s)] 0.125,a,Explanation: The rate of condensation heat transfer is higher at the upper end of the plate than at the lower end. 
Question 699,6. Mark the wrong statement with respect to laminar flow condensation on a vertical plate,a) The rate of condensation heat transfer is maximum at the upper edge of the plate and progressively decreases as the lower edge is approached,b) The average heat transfer coefficient is two third of the local heat transfer coefficient at the lower edge of the plate,"c) At a definite point on the heat transfer, the film coefficient is directly proportional to thermal conductivity and inversely proportional to thickness of film at the point",d) The film thickness increases as the fourth root of the distance down the upper edge,b,Explanation: The average heat transfer coefficient is 4/3 of the local heat transfer coefficient at the lower edge of the plate. 
