Question Name,Question,Option A,Option B,Option C,Option D,Answer,Explanation
Question 154,9. A hollow sphere (k = 30 W/m K) of inner radius 6 cm and outside radius 8 cm has a heat generation rate of 4000000 W/m3. The inside surface is insulated and heat is removed by convection over the outside surface by a fluid at 100 degree Celsius with surface conductance 300 W/m2 K. Make calculations for the temperature at the outside surfaces of the sphere,a) 105.6 degree Celsius,b) 205.6 degree Celsius,c) 305.6 degree Celsius,d) 405.6 degree Celsius,c,Explanation: q g 4 π (R 3 – r 3)/3 = h 0 4 π r 2 (t 2 – t a). 
Question 155,"10. Consider the above problem, also calculate the temperature at the inside surfaces of the sphere",a) 138.3 degree Celsius,b) 327.8 degree Celsius,c) 254.7 degree Celsius,d) 984.9 degree Celsius,b,Explanation: t = t 2 + q g (R 2 – r 2)/6 k – q g r 3 (1/r – 1/R)/3 k. 
Question 156,1. A very long copper rod 20 mm in diameter extends horizontally from a plane heated wall maintained at 100 degree Celsius. The surface of the rod is exposed to an air environment at 20 degree Celsius with convective heat transfer coefficient of 8.5 W/m2 degree. Workout the heat loss if the thermal conductivity of copper is 400 W/m degree,a) 10.71 W,b) 20.71 W,c) 30.71 W,d) 40.71 W,b,Explanation: P/A = 4/d and m = (h P/k A) _ = (4 h/k d) _ = 2.061.per meter. 
Question 157,2. Common applications of finned surfaces are with,(i) Electrical motors,(ii) Economizers for steam power plant,(iii) Convectors for steam and cold water heating systems,(iv) Cooling coils,a,Explanation: It should be for hot water heating systems. 
Question 158,3. The extended surface used for the enhancement of heat dissipation is,a) Convective coefficient,b) Fourier number,c) Fin,d) No finned surface,c,"Explanation: The surface area exposed to the surroundings is frequently increased by the attachment of protrusions to the surfaces, and the arrangement provides a means by which heat transfer rate can be improved. "
Question 159,4. It is said that fins can take a variety of forms,(i) Longitudinal fins of rectangular cross section attached to a wall,(ii) Cylindrical tubes with radial fins,(iii) Conical rod protruding from a wall,Identify the correct statement,d,Explanation: Option b is also known as annular fins. 
Question 160,5. A steel rod (k = 30 W/m degree) 1 cm in diameter and 5 cm long protrudes from a wall which is maintained at 10 degree Celsius. The rod is insulated at its tip and is exposed to an environment with h = 50 W/m2 degree and t a = 30 degree Celsius. Calculate the fin efficiency,a) 56.57%,b) 66.57%,c) 76.57%,d) 86.57%,b,"Explanation: Fin efficiency = tan h ml/ml, where m = (h P/k A) _ = 25.82 per meter. "
Question 161,"6. If the fin is sufficiently thin, so heat flows pertain to",a) One dimensional heat conduction,b) Two dimensional heat conduction,c) Three dimensional heat conduction,d) No heat flow is there,a,"Explanation: As, _ is less than b, so one dimensional heat conduction is there. "
Question 162,"7. If heat dissipation for one fin is given by 377.45 k J/hour, then what is the heat dissipation for 12 fins?",a) 7529.4 k J/hour,b) 6529.4 k J/hour,c) 5529.4 k J/hour,d) 4529.4 k J/hour,d,"Explanation: For 12 fins, the heat dissipation will be equal to 12 (377.45) = 4529.4 k J/hour. "
Question 163,"8. In order to achieve maximum heat dissipation, the fin should be designed in such a way that has a",a) Maximum lateral surface towards the tip side of fin,b) Minimum lateral surface near the center line,c) Maximum lateral surface at the root side of fin,d) Maximum lateral surface near the center of fin,c,Explanation: Fins are so designed that lateral surface at the root side of the fin is maximum. This aspect results into higher heat dissipation. 
Question 164,9. A steel rod (k = 30 W/m degree) 1 cm in diameter and 5 cm long protrudes from a wall which is maintained at 10 degree Celsius. The rod is insulated at its tip and is exposed to an environment with h = 50 W/m2 degree and t a = 30 degree Celsius. Calculate the rate of heat dissipation,a) 2.658 W,b) 3.658 W,c) 4.658 W,d) 5.658 W,b,Explanation: Q = k A m tan h ml (t 0 – t a) = 3.658 W. 
Question 165,"10. On a heat transfer surface, fins are provided to",a) Increase turbulence in flow for enhancing heat transfer,b) Increase temperature gradient so as to enhance heat transfer,c) Pressure drop of the fluid should be minimized,d) Surface area is maximum to promote the rate of heat transfer,d,Explanation: Fins are provided to a heat exchanger surface to augment the heat transfer by increasing the surface area exposed to the surroundings.
Question 166,1. Which one is true regarding rectangular fin?,a) A C = b _ and P = 2(b + _),b) A C = 2 b _ and P = 2(b + _),c) A C = 3 b _ and P = 2(b + _),d) A C = 4 b _ and P = 2(b + _),a,"Explanation: For rectangle, A = (length) (breadth). Where, b = width and _ = thickness."
Question 167,2. Analysis of heat flow from the finned surface is made with the following assumptions,"(i) Uniform heat transfer coefficient, h over the entire fin surface",(ii) No heat generation within the fin generation,(iii) Homogenous material,Identify the correct option,c,Explanation: The knowledge of temperature distribution is necessary for their optimum design with regard to size and weight. 
Question 168,3. If heat conducted into the element at plane x is Q X = – k A C (d t/d x) X. Then heat conducted out of the element at plane (x + d x) is,a) – 2k A C d/d x (t + d t/d x (d x)),b) – k A C d/d x (t + d t/d x (d x)),c) – 3k A C d/d x (t + d t/d x (d x)),d) – 4k A C d/d x (t + d t/d x (d x)),b,Explanation: Heat conducted out of the element is – [k A C (d t/d x) X + d x]. 
Question 169,"4. A heating unit is made in the form of a vertical tube of 50 mm outside diameter and 1.2 m height. The tube is fitted with 20 steel fins of rectangular section with height 40 mm and thickness 2.5 mm. The temperature at the base of fin is 75 degree Celsius, the surrounding air temperature is 20 degree Celsius and the heat transfer coefficient between the fin as well as the tube surface and the surrounding air is 9.5 W/m2 K. If thermal conductivity of the fin material is 55 W/m K, find the amount of heat transferred from the tube without fin",a) 98.44 W,b) 88.44 W,c) 78.44 W,d) 68.44 W,a,Explanation: Q = h A d t = h (π d 0 H) (t 0 – t INFINITY). 
Question 170,5. The general solution of linear and homogenous differential equation (second form) is of the form,a) _ = C 1 e 2 m x + C 2 e – m x,b) _ = C 1 e 3m x + C 2 e – m x,c) _ = C 1 e 4 m x + C 2 e – m x,d) _ = C 1 e m x + C 2 e – m x,d,Explanation: It should contain m x and – m x term. 
Question 171,"6. For steady flow of heat along a rod, the general equation is",d2_/dx 2 – m 2 _ = 0,The value of constant m is,a) (h P/k A C),b) (h P/k A C) 3/2,c,Explanation: This provides a general form of the energy equation for one dimensional heat flow. 
Question 172,"7. In convection from the tip, we introduced a factor known as",a) Fin length,b) Correction length,c) No fin length,d) Radial length,b,Explanation: Just for simplicity we replace fin length by correction length. 
Question 173,8. Find the value of corrected length for rectangular fin?,"Where, b is width and t is length of the fin",a) L C = L + b t/2 (b + t),b) L C = L + b t/ (b + t),c) L C = L + 2 (b + t),a,"Explanation: For rectangle, area = t b. "
Question 174,9. Which one is true for the spine?,a) A C = π d 2/4 and P = 4 π d,b) A C = π d 2/4 and P = 3 π d,c) A C = π d 2/4 and P = π d,d) A C = π d 2/4 and P = 2 π d,c,Explanation: A spine is a pin fin. 
Question 175,10. In convection from the tip what is the value of correction length?,a) L C = A C/P,b) L C = L + A C,c) L C = L + P,d) L C = L + A C/P,d,"Explanation: It should contain all the three terms i.e. L, A and P. "
Question 176,"1. In heat dissipation from an infinitely long fin, the boundary conditions are",a) t = t0 at x = infinity and t = ta at x = 0,b) t = t0 at x = 0 and t = ta at x = infinity,c) t = t0 at x = 0 and t = ta at x = 0,d) t = t0 at x = infinity and t = ta at x = infinity,b,Explanation: These conditions must be approached when ml is greater than 5. 
Question 177,2. The temperature distribution in case of infinitely long fin is,a) t – t a/t 0 – t a = mx,b) t – t a/t 0 – t a = -mx,c) t – t a/t 0 – t a = e-m x,d) t – t a/t 0 – t a = log (m x),c,Explanation: Exponential curve should be here. 
Question 178,3. The rate of heat transfer in case of infinitely long fin is given by,a) (h P k A) 1/2 (t 0 – t a),b) (h P A) 1/2 (t 0 – t a),c) (P k A) 1/2 (t 0 – t a),d) (h k A) 1/2 (t 0 – t a),a,"Explanation: It should contain all the terms i.e. h, p, k and A. "
Question 179,"4. Let us say there are two rods having same dimensions, one made of brass (k = 85W/m K) and the other of copper (k = 375W/m K), having one of their ends inserted into a furnace. At a section 10.5 cm away from the furnace, the temperature of brass rod is 120 degree Celsius. Find the distance at which the same temperature would be reached in the copper rod? Both ends are exposed to the same environment",a) 12.54 cm,b) 45.87 cm,c) 12.34 cm,d) 22.05 cm,d,"Explanation: For brass rod, 120 = t a + (t 0 – t a) e –m l and for copper rod, 120 = t a + (t     0 – t a) e –M L So L = L 0 (k 2/k 1) = 22.05 cm. "
Question 180,"5. Three rods, one made of silver (l = 420W/m K), second made of aluminum (k = 210W/m K) and the third made of iron (k = 70W/m K) are coated with a uniform layer of wax all around. The rods are placed vertically in a boiling water bath with 250 mm length of each rod projecting outside. If all the rods are having following dimensions i.e. diameter = 15 mm and length = 300 mm and have identical surface coefficient 12.5W/ m2 K, work out the ratio of lengths up to which wax will melt on each rod",a) 2.45:1:1.732,b) 1.732:1:2.45,c) 2.45:1.732:1,d) 1.732:1:2.45,c,Explanation: k 1/l 12 = k 2/l 22 = k 3/l 32. 
Question 181,7. A rod of 10 mm square section and 160 mm length with thermal conductivity of 50W/m K protrudes from a furnace wall at 200 degree Celsius with convective coefficient 20 W/ square m K. Make calculations for the heat convective up to 80 mm length,a) 6.84W,b) 7.34W,c) 4.54W,d) 5.47W,a,"Explanation: Q = k A C m (t 2 – t 1), m = (P h/k AC) 1/2 = 12.649 /m, so Q = 10.75W. At x = 80 mm, (m x) = 1.01192, so T – 30/200 – 30 = 0.3635. Therefore net heat is 10.75 – k A C m (t 0.08 – t a) = 6.84W. "
Question 182,8. A fin protrudes from a surface which is held at a temperature higher than that of its environment. The heat transferred away from the fin is,a) Heat escaping from the tip of the fin,b) Heat conducted along the fin length,c) Convective heat transfer from the fin surface,d) Sum of heat conducted along the fin length and that convected from the surface,c,"Explanation: As the temperature is higher, so it’s convective. "
Question 183,9. The value of correction length for equilateral fin is,a) L C = 2 L + a/4(3)1/2,b) L C = L + a/4(3)1/2,c) L C = 3 L + a/4(3)1/2,d) L C = 6 L + a/4(3)1/2,b,Explanation: Area of triangle i.e. equilateral is (3)1/2/4. 
Question 184,"10. The parameter m = (h P/k A C) 1/2 has been stated to increase in a long fin. If all other parameters are constant, then",a) Profile of temperature will remain the same,b) Along the length temperature drop will be less,c) The parameter influences the heat flow only,d) The temperature drop along the length will be steeper,d,Explanation: For an infinitely long fin t – t a/t 0 – t a = e – m x. Dimensionless temperature falls more with increase in factor m. 
Question 185,1. The relevant boundary conditions in case of heat dissipation from a fin insulated at the tip are,a) t = t 0 at x = 0 and d t/d x = 0 at x = 0,b) t = t 0 at x = 0 and d t/d x = 0 at x = 1,c) t = t 0 at x = 1 and d t/d x = 0 at x = 1,d) t = t 0 at x = infinity and d t/d x = 0 at x = infinity,b,Explanation: It should be at x = 0 and x = 1 respectively. 
Question 186,2. The temperature distribution in case of fin insulated at the tip is given by,a) t – t0/t0 – t a = cos h m (3 – x)/cos ml,b) t – t0/t0 – t a = cos h m (2 – x)/sin h ml,c) t – t0/t0 – t a = cos h m (l – x)/cos h ml,d) t – t0/t0 – t a = cos m (l – x)/sin ml,c,Explanation: It should contain cos h term and (1 – x) term. 
Question 187,3. The rate of heat transfer from the fin in case of fin insulated at the tip is,a) (h P k A)1/2 (t 0 – t a) tan h ml,b) (h k A)1/2 (t 0 – t a) tan h ml,c) (h P A)1/2 (t 0 – t a) tan h ml,d) (h P k)1/2 (t 0 – t a) tan h ml,a,"Explanation: It should contains all the terms i.e. h, A, P, k. "
Question 188,4. “Fin is insulated at the tip”. What does that mean?,a) Less heat is transferred from the tip,b) Heat will transferred from tip only,c) More heat is transferred from the tip,d) No heat is transferred from the tip,d,Explanation: The fin is of finite length with the tip insulated and so no heat is transferred from the tip. 
Question 189,5. Find the heat transfer rate from a hot surface for 6 fins of 10 cm length? The base temperature of the fin is maintained at 200 degree Celsius and the film is exposed to a convection environment at 15 degree Celsius with convective coefficient 25W/square m K. Each fin has cross-sectional area 2.5 square centimeter and is made of a material having thermal conductivity 250W/m K,a) 120.34W,b) 130.18W,c) 145.46W,d) 165.43W,b,"Explanation: n = 6 and l = 10 cm = 0.1 m, ml = 0.4472, Q = 6[(250) (2.5 * 10– 4) (4.472) (200 – 15) tan h (0.4472) = 130.18W. "
Question 190,"7. An electronic semiconductor device generates 0.16 k J/hr of heat. To keep the surface temperature at the upper safe limit of 75 degree Celsius, it is desired that the heat generated should be dissipated to the surrounding environment which is at 30 degree Celsius. The task is accomplished by attaching aluminum fins, 0.5 square mm and 10 mm to the surface. Work out the number of fins if thermal conductivity of fin material is 690W/m K and the heat transfer coefficient is 45k J/square m hr K. Neglect the heat loss from the tip of the fin",a) 4,b) 3,c) 2,d) 1,a,"Explanation: P = 2(0.5 + 0.5) = 2 mm, A = (0.5) (0.5) = 0.25 square meter. m = 22.85 per meter, so Q = k A m (t 0 –ta) tan h ml = 39.77 * 10-3 k J/hr per fin. So number of fins = 0.16/39.77 * 10 -3 = 4.02. "
Question 191,8. A rod of 10 mm diameter and 80 mm length with thermal conductivity 16W/ m K protrudes from a surface at 160 degree Celsius. The rod is exposed to air at 30 degree Celsius with a convective coefficient of 25W/square m K. How does the heat flow from this rod get affected if the same material volume is used for two fins of the same length? Assume short fin with insulated end,a) 12.25 %,b) 25.6 %,c) 23.4 %,d) 21.2 %,d,"Explanation: Case 1 – m1 = 25 per meter, m1 l = 25 * 0.08 = 2. Therefore, Q1 = 3.935WCase 2 – d =0.00707 m, m2 = 29.73 per meter, m2 l = 2.378. Therefore, Q2 = 2.385W% increase in heat flow = 4.77 – 3.935/3.935 = 0.21. "
Question 192,"9. Two rods A and B of the same length and diameter protrude from a surface at 120 degree Celsius and are exposed at air at 25 degree Celsius. The temperatures measured at the end of the rods are 50 degree Celsius and 75 degree Celsius. If thermal conductivity of material A is 20W/ m K, calculate it for B",a) 31.13W/m K,b) 41.13W/m K,c) 51.13W/m K,d) 61.13W/m K,c,"Explanation: _/ _0 = t – t a/t 0– ta = 1/cos h ml. For rod A, cos h m1 l =3.8. Similarly for rod 2, cos h m2 l = 1.9, m1/m2 = 1.599. So k2 = k1 (1.599)2 = 51.13W/m K. "
Question 193,"10. A centrifugal pump which circulates a hot liquid metal at 500 degree Celsius is driven by a 3600 rpm electric motor. The motor is coupled to the pump impeller by a horizontal steel shaft of dia 25 mm. Let us assume the motor temperature as 60 degree Celsius with the ambient air at 25 degree Celsius, what length of shaft should be specified between the motor and the pump? It may be presumed that the thermal conductivity of the shaft material is 35W/m K and that the convective film coefficient between the steel shaft and the ambient air is 15.7W/square m K",a) 38.96 cm,b) 54.76 cm,c) 23.76 cm,d) 87.43 cm,a,"Explanation: 60 – 25/500 – 25 = cos h m (l – l)/cos h ml = 1/cos h ml, so ml = 3.3. For a circular shaft of diameter d, P/A = 4/d, m = 8.47 per meter. So, l = 3.3/8.47 = 38.96 cm. "
Question 194,1. The utility of fin in dissipating a given quantity of heat is generally assessed on the basic of how many parameters?,a) 1,b) 2,c) 3,d) 4,b,Explanation: It depends on two parameters i.e. efficiency of fin and effectiveness of fin. 
Question 195,2. A copper steel rod (k = 55 W/m degree) has been attached to a plane wall which is maintained at a temperature of 350 degree Celsius. The rod is 8 cm long and has the cross-section of an equilateral triangle with each side 5 mm. Determine the heat dissipation from the rod if it is exposed to a convection environment at 25 degree Celsius with unit surface conductance 100 W/m2 degree. Consider end surface loss to be negligible,a) 10.26 W,b) 9.26 W,c) 8.26 W,d) 7.26 W,b,"Explanation: For a fin of triangular cross-section, P = 3a and m = (h P/k A) _ = 50.19 per meter."
Question 196,"3. For an infinitely long fin, the efficiency of fin is given by",a) 1/ml,b) 2/ml,c) 3/ml,d) 4/ml,a,"Explanation: On simplify (p h k A C) 1/2 (t 0 – ta) tan h (ml)/h (p l) (t 0 – ta), we get it as tan h (ml)/ml. And here for very long fin numerator should be equal to 1. "
Question 197,"4. For a fin of finite length with an insulated end, the fin efficiency is given as",a) tan h (ml),b) tan (ml)/ml,c) tan h (m)/ml,d) tan h (ml)/ml,d,"Explanation: On simplify (h p k A C) 1/2 (t 1 – t 2) tan h (ml)/h (p l) (t 1 – t2), we get it as tan h (ml)/ml. "
Question 198,"5. For an infinitely long fin, the effectiveness of fin is given as",a) (P k/h AC),b) (P k/h AC)3/2,c) (P k/h AC)1/2,d) (P k/h AC)2,c,"Explanation: Q FIN = (h k P AC) 1/2 (t2– t 1), so effectiveness is (h P k A C)1/2 (t 2 – t 1)/h A(t 0 – t a). "
Question 199,"6. For a straight rectangular fin of thickness _ and width b, choose the correct option",a) P/AC = 1/ _,b) P/AC = 2/ _,c) P/AC = 3/ _,d) P/AC = 4/ _,b,"Explanation: As fin effectiveness in case of straight rectangular fin is (2k/h _)1/2. So, P/A = 2(b + _)/b _. "
Question 200,"8. Three fins of equal length and diameter but made of aluminum, brass and cast iron is heated to 200 degree Celsius at one end. If the fins dissipate heat to the surrounding air at 25 degree Celsius, the temperature at the free end will be least in",a) Brass fin,b) Cast iron fin,c) Aluminum fin,d) Each fin will have the same temperature,c,Explanation: Thermal conductivity of aluminum is higher than that of others. 
Question 201,"9. Two long rods A and B of the same diameter have thermal conductivities k and 4k and have one of their end inserted into a furnace at 400 K. At 9.5 m away section from the furnace, the temperature of rod B is120 degree Celsius. So find out at what end from the furnace end, the same temperature would be reached in the rod A?",a) 0.25 m,b) 0.75 m,c) 0.15 m,d) 0.50 m,a,"Explanation: k A /l A2 = k B /l B2, so it is 0.25 m. "
Question 202,1. The following factors need consideration for the optimum design of fins,(i) Cost,(ii) Space considerations,(iii) Weight considerations,Choose the correct option,c,Explanation: The design will be considered optimum when the fins require minimum cost of manufacture are light in weight. 
Question 203,"2. A heating unit is made in the form of a vertical tube of 50 mm outside diameter and 1.2 m height. The tube is fitted with 20 steel fins of rectangular section with height 40 mm and thickness 2.5 mm. The temperature at the base of fin is 75 degree Celsius, the surrounding air temperature is 20 degree Celsius and the heat transfer coefficient between the fin as well as the tube surface and the surrounding air is 9.5 W/m2 K. If thermal conductivity of the fin material is 55 W/m K, find the amount of heat transferred from the tube with fin",a) 1234 .98 W,b) 1004.84 W,c) 6539.83 W,d) 3829.46 W,b,"Explanation: Heat flow rate convicted from the base, Q b = h A b (t 0 – t INFINITY) and heat flow rate convicted from the fins, Q f = n k A C m (t 0– t a). "
Question 204,3. The fins would be effective for heat conduction if the ratio P k/h A C is,a) Greater than 5,b) Less than 5,c) Equal to 5,d) Varies between 2 to 9,a,Explanation: The ratio perimeter divided by area multiply by length must be greater than 5. 
Question 205,4. Consider the following statements pertaining to heat transfer through fins,(i) They must be arranged at right angles to the direction of flow of working fluid,(ii) The temperature along the fin is variable and accordingly heat transfer rate varies along the fin elements,(iii) Fins are equally effective irrespective whether they are on the hot side or cold side of the fluid,(iv) Fins are made of materials that have thermal conductivity higher than that of wall,d,Explanation: The statements made at serial number 3 and 4 are wrong. Fins are located on the side where the convective coefficient has a low value.
Question 206,5. An increase in fin effectiveness is caused by a high value of,(i) Convective coefficient,(ii) Thermal conductivity,(iii) Circumference,(iv) Area,c,"Explanation: Refer to the expression for fin effectiveness, an increase in fin effectiveness is caused by high value of circumference and thermal conductivity."
Question 207,7. Choose the correct option regarding fin efficiency and fin effectiveness,a) 2 Fin effectiveness = A FIN/A B (Efficiency of fin),b) 3 Fin effectiveness = A FIN/A B (Efficiency of fin),c) Fin effectiveness = A FIN/A B (Efficiency of fin),d) _ Fin effectiveness = A FIN/A B (Efficiency of fin),c,Explanation: On simplify the equations of fin efficiency and fin effectiveness we get the result. 
Question 208,"8. The handle of a saucepan, 30 cm long and 2 cm in diameter, is subjected to 100 degree Celsius temperature during a certain cooking operation. The average unit surface conductance over the handle surface is 7.35 W/m2 degree in the kitchen air at 24 degree Celsius. The cook is likely to grasp the last 10 cm of the handle and hence the temperature in this region should not exceed 38 degree Celsius. What should be the thermal conductivity of the handle material to accomplish it? The handle may be treated as a fin insulated at the tip",a) 18.36 W/m degree,b) 17.36 W/m degree,c) 16.36 W/m degree,d) 15.36 W/m degree,b,"Explanation: _ x/_ 0 = t x –ta/t 0 –t a= cos m (l – x)/cos ml. Now, for a circular handle of diameter d, P/A = 4/d."
Question 209,9. Let us assume a square section fin split longitudinally and used as two fins. This will result in,a) Increase or decrease in heat transfer depending on the material of fin,b) Heat flow remains constant,c) Decrease in heat transfer,d) Increase in heat transfer,d,Explanation: Heat transfer will definitely increases because it split into two fins i.e. more surface area. 
Question 210,10. Mark the false statement regarding effectiveness of fin,a) A high value of film coefficient adversely affects the fin effectiveness,b) Fin effectiveness is improved if the fin is made from a material of low conductivity,c) Fin effectiveness is improved by having thin fins,d) It can also be improved by having closely spaced fins,b,Explanation: It should be of high thermal conductivity. 
Question 211,1. Which fin yields the maximum heat flow per unit weight?,a) Straight triangular fin,b) Curved triangular fin,c) Parabolic fin,d) Hyperbolic fin,a,"Explanation: In straight triangular fin, there is maximum heat flow. "
Question 212,2. Heat dissipation by every segment of the fin is,a) Sometimes same,b) Same,c) Not same,d) Sometimes same or sometimes not same,c,Explanation: It is always different as fins are not uniform with respect to cross-sectional area. 
Question 213,4. Which one is true regarding parabolic fin?,a) It dissipates the minimum amount of heat at a minimum material cost,b) It dissipates the minimum amount of heat at a maximum material cost,c) It dissipates the maximum amount of heat at a maximum material cost,d) It dissipates the maximum amount of heat at a minimum material cost,d,"Explanation: In this case, a parabolic fin is of great practical importance. "
Question 214,"5. For parabolic fin, the curve follows which law?",a) y = C/x2,b) y = C x4,c) y = C x2,d) y = C x1/2,c,Explanation: Equation of parabola is y = 4 x2 or x = 4 y2. 
Question 215,6. The correction length for cylindrical fin is,a) L C = L + d/4,b) L C = 2 L + d/4,c) L C = 3 L + d/4,d) L C = 4 L + d/4,a,"Explanation: Area = π d2/4. Where, d is the diameter."
Question 216,7. Provision of fins on a given heat transfer surface will be more effective if there is,a) Fewer but thick fins,b) Large number of thick fins,c) Fewer but thin fins,d) Large number of thin fins,d,Explanation: Increase in ratio of perimeter P to be cross sectional area A C brings about improvement in the effectiveness of fins. 
Question 217,8. The heat dissipation at any section of parabolic fin is given by,a) (t2 – t1) (b) (_),b) k (t2 – t1) (b) (_),c) k (t2 – t1) (_),d) k (t2 – t1) (b),b,Explanation: Q = qx (A X) = k (t2 – t1) (b) (_). 
