Question Name,Question,Option A,Option B,Option C,Option D,Answer,Explanation
Question 367,4. What should be the appropriate thickness of the metal sheet when it is used as a raw material for the sheet metal operations?,a) 1 cm to 5 cm,b) 5 cm to 10 cm,c) 7.5 mm to 15 mm,d) 0.4 mm to 6 mm,d,"Explanation: The sheet metal forming and cutting operations are mainly performed on relatively thin sheets of metal. The thickness of metal sheet should be 0.4 mm to 6 mm to operate efficiently. If the thickness is more than 6 mm, then it is normally called as metal plate. The operations are generally performed as cold working. "
Question 368,8. Which of the following types of force is predominant in the sheet metal forming processes?,a) Shearing force,b) Compressive force,c) Tensile force,d) Indirect compressive force,c,"Explanation: Tensile force is the predominant force in most of the sheet metal forming operations as compared to the bulk forming which basically involves compressive forces. Due to the tensile stresses in the metal sheets, they may experience localized deformation which is further followed by cracking."
Question 369,10. Which of the following materials is used for the manufacturing of dies and punches in the sheet metal forming?,a) Grey cast iron,b) Copper,c) Aluminium,d) Carbide,d,"Explanation: Carbide is mainly used for the manufacturing of dies and punches in the sheet metal forming operations. Sometimes tool steel is also preferred to maintain the lateral rigidity in the tools. Dies and punches must possess mechanical properties such as hardness, strength, rigidity, toughness, machinability etc."
Question 370,5. Which of the following processes is mainly used for making the connecting rods?,a) Casting,b) Deep drawing,c) Rolling,d) Forging,d,"Explanation: Connecting rods are generally manufactured by the forging operation. In forging, a hammer is used which strikes on the heated metallic part to get into the desired shape. The properties like strength, toughness, etc are greatly enhanced by performing the forging operation. Forging can be open die forging or closed die forging."
Question 371,5. Which of the following methods of forming is not the part of electromagnetic forming?,a) Compression,b) Expansion,c) Shearing,d) Counter forming,c,"Explanation: In the electromagnetic forming process, electromagnetic formation mainly used for three forming methods which can be compression, expansion, and counter forming. For compression, a tubular metal is compressed by a coil, usually against a grooved tube. And shearing is a different process which is not a part of electromagnetic forming."
Question 372,9. Which of the following is the main advantage of using the electromagnetic forming process?,a) High speed,b) Low maintenance,c) Applicable to all materials,d) No spring-back,d,"Explanation: In the electromagnetic forming process, the metal is loaded and achieve plastic region, which results in plastic or permanent deformation, so that the spring-back associated with mechanical forming process is completely eliminated, because no any mechanical contact is present during the process of metal forming. "
Question 373,1. What is the melting point of pure iron?,a) 1500°C,b) 1535°C,c) 1570°C,d) 1605°C,b,"Explanation: Iron exists in many allotropic forms, and every such allotropic form has a different melting, boiling and solidifying point. But, for pure iron, the melting point is 1535°C. "
Question 374,2. Which iron is formed when the melt is frozen?,a) Alpha,b) Beta,c) Gamma,d) Delta,d,"Explanation: Alpha irons, beta irons or gamma irons cannot be formed when the metal is in the frozen form. When the molten metal is frozen, delta iron is formed. "
Question 375,3. What is the kind of lattice in a delta iron?,a) Face centered cubic,b) Body centered cubic,c) Hexagonal closely packed,d) Tetragonal closely packed,b,"Explanation: The delta form of solid state of iron, which is formed on cooling the melt, has a body centered cubic lattice structure. "
Question 376,4. What is the kind of lattice in a gamma iron?,a) Face centered cubic,b) Body centered cubic,c) Hexagonal closely packed,d) Tetragonal closely packed,a,"Explanation: The gamma form of solid state of iron, which is formed on cooling the melt, has a face centered cubic lattice structure. "
Question 377,"5. In transformation in steel, hypo eutectoid steel are heated up to what temperature?",a) 677°C,b) 700°C,c) 723°C,d) 746°C,c,"Explanation: In transformation in steel, the hypo eutectoid steels are heated up to a very high amount of temperature. The temperature to which they are taken is 723°C. "
Question 378,6. What is the Brinell hardness of pearlite?,a) 150,b) 180,c) 210,d) 240,b,"Explanation: Pearlite is not the hardest form. The Brinell hardness of pearlite is only 180. There is a harder material than pearlite, called as martensite, which has Brinell hardness ranging from 650-700. "
Question 379,8. How much is the Brinell hardness of martensite?,a) 600-650,b) 650-700,c) 750-800,d) 800-850,b,"Explanation: Martensite is a ferro-magnetic substance in nature, and it is known to have Brinell hardness ranging from 650-700. "
Question 380,9. What is the value of ‘a’ in a delta iron lattice?,a) 2.00 Å,b) 2.93 Å,c) 4.00 Å,d) 4.93 Å,b,"Explanation: The value of a, which is the distance between two consecutive atoms in the lattice, in delta iron lattice is calculated to be 2.93 Å, which is around 2.93 x 10-10 meters. "
Question 381,1. HPF steel is normalized at what temperature?,a) 800°C,b) 900°C,c) 1000°C,d) 1100°C,b,Explanation: The HPF steel has to be taken to high magnitudes of temperatures. The HPF steel or the hot press forming steel gets normalized at 900°C. 
Question 382,2. What is the Vickers hardness of steel before the HPF process?,a) 150 Hv,b) 160 Hv,c) 170 Hv,d) 180 Hv,c,"Explanation: The HPF process in steels is considered to be a very important process, it involves heating the steel to high temperatures. The Vickers hardness of steel before HPF process is 170 Hv. "
Question 383,3. What is the Vickers hardness of steel after the HPF process?,a) 362 Hv,b) 462 Hv,c) 562 Hv,d) 662 Hv,b,Explanation: The HPF process is a very essential process. The Vickers hardness of the material is found to change after this process is done. The Vickers hardness of steel after HPF process is 462 Hv. 
Question 384,4. What is the amount of carbon used in HPF steel?,a) Less than 0.37%,b) Less than 0.27%,c) Less than 0.47%,d) Less than 0.57%,b,Explanation: The carbon content which is used in HPF steel is very less in percentage composition. The amount of carbon used in terms of percentage weight is less than 0.27%.
Question 385,5. What is the amount of silicon used in HPF steel?,a) Less than 0.30%,b) Less than 0.20%,c) Less than 0.40%,d) Less than 0.50%,d,Explanation: The silicon content which is used in HPF steel is very less in percentage composition. The amount of silicon used in terms of percentage weight is less than 0.50%.
Question 386,6. What is the amount of boron used in HPF steel?,a) Less than 0.003%,b) Less than 0.007%,c) Less than 0.009%,d) Less than 0.057%,a,Explanation: The boron content which is used in HPF steel is extremely less in percentage composition. The amount of boron used in terms of percentage weight is less than 0.003%.
Question 387,7. What is the amount of tungsten used in HPF steel?,a) Less than 0.03%,b) Less than 0.02%,c) Less than 0.04%,d) Less than 0.05%,d,Explanation: The tungsten content which is used in HPF steel is very less in terms of percentage composition. The amount of tungsten used in terms of percentage weight is less than 0.05%.
Question 388,8. What is the amount of nitrogen used in HPF steel?,a) Less than 0.03%,b) Less than 0.02%,c) Less than 0.04%,d) Less than 0.05%,b,Explanation: The nitrogen content which is used in HPF steel is very less in percentage composition.  The amount of nitrogen used in terms of percentage weight is less than 0.02%.
Question 389,1. Which of the following processes is called as quenching?,a) Slow cooling,b) Slow heating,c) Rapid cooling,d) Rapid heating,c,"Explanation: Among the following, that is, slow cooling, slow heating, rapid cooling and rapid heating, quenching is the name given to the process of rapid cooling. "
Question 390,"2. On martensite formation, what is the percentage increase in the volume of the steel?",a) 3%,b) 13%,c) 23%,d) 33%,a,"Explanation: It has been observed that whenever there is a formation of martensite, there is some amount of increase in the volume accompanied by it. This increase in the volume is about 3%."
Question 391,3. How much is the Brinell hardness of sorbite?,a) 250,b) 350,c) 450,d) 550,b,Explanation: The cementite in sorbite is known to be very finely divided. The material sorbite is not one of the hardest materials known in casting. The Brinell hardness of sorbite is 350. 
Question 392,4. How much is the Brinell hardness of troostite?,a) 250,b) 350,c) 450,d) 550,c,Explanation: The cementite in troostite is very finely divided. The material troostite is not one of the hardest materials known in casting.  The Brinell hardness of sorbite is 450. 
Question 393,5. What is the chemical formula of cementite?,a) Fe3O4,b) Fe2O3,c) Fe3C,d) FeSO4,c,Explanation: None.
Question 394,6. What is the crystal structure of cementite?,a) Orthogonal,b) Pyramidal,c) Trapeziodal,d) Orthorhombic,d,"Explanation: The crystal structure of the compound cementite or iron carbide is not orthogonal or pyramidal or trapezoidal, but it is orthorhombic. "
Question 395,7. What is the curie temperature of cementite?,a) 480K,b) 500K,c) 520K,d) 540K,a,"Explanation: The compound cementite is also called as Iron Carbide. The chemical formula of the compound cementite is Fe3C. The curie temperature of the compound cementite, is approximately about 480K. "
Question 396,8. What is the percentage weight of iron in cementite?,a) 93.3%,b) 94.3%,c) 95.3%,d) 96.3%,a,"Explanation: In the compound iron carbide or cementite, the percentage weight of iron is 93.3% and the rest of the space in the lattice is occupied by carbon. By weight, carbon is present in about 6.67% in the mixture. "
Question 397,9. What is the percentage weight of carbon in cementite?,a) 5.53%,b) 6.67%,c) 7.23%,d) 8.39%,b,Explanation: None.
Question 398,1. Which of the following is not an objective of annealing?,a) Softening of steel,b) Hardening of steel,c) Increase ductility,d) Relieve internal stress,b,"Explanation: Among the many purposes of treating the steel through annealing is softening of steel, hardening of steel and relieving the internal stresses, but annealing is not used for hardening of the steel. "
Question 399,"2. In full annealing, the steel is heated at what temperature?",a) Above critical temperature,b) Above vaporization temperature,c) Above liquefying temperature,d) Above solidification temperature,a,"Explanation: In the process of full annealing, the steel has to be heated slightly above the critical temperature. At this point, the steel has to be held for a considerable amount of time. "
Question 400,"3. In annealing process, for the formation of hypereutectoid steel, the steel has to be heated above what point?",a) Ac1,b) Ac2,c) Ac3,d) Ac4,a,"Explanation: For the formation of hypereutectoid steel, in annealing process, the steel has to be heated above the Ac1 point, which is the lower critical line in the temperature versus carbon content graph. "
Question 401,"4. In annealing process, for the formation of hypoeutectoid steel, the steel has to be heated above what point?",a) Ac1,b) Ac2,c) Ac3,d) Ac4,c,Explanation: None.
Question 402,5. For how long is the heated steel held in full annealing process?,a) 1 minute,b) 3 minutes,c) 6 minutes,d) 9 minutes,b,"Explanation: The heated steel is held at the critical temperature for about 3 to 4 minutes. By doing this, the steel gets enough time to make the internal changes desired. "
Question 403,"6. In full annealing, the metal cannot be buried in which of the following materials?",a) Sand,b) Lime,c) Ashes,d) Manganese powder,d,"Explanation: In the process, full annealing, if the metal is removed at high temperatures, they need to be buried. For this, the material cannot be manganese powder. "
Question 404,8. Which of the following is also called as diffusion annealing?,a) Isothermal annealing,b) Process annealing,c) Homogenizing,d) Spheroidise annealing,c,"Explanation: Homogenising has another name as diffusion annealing. This method is applied to both the ingots, carbon as well as alloy steel. "
Question 405,9. At what temperature is homogenizing carried out?,a) 1150°C,b) 1370°C,c) 1420°C,d) 1320°C,a,"Explanation: Homogenizing is carried out between temperature ranges of 1100°C to 1200°C, but the most optimum temperature is 1150°C, at which the diffusion process goes ahead smoothly."
Question 406,1. Which of the following forming processes is suitable for making utensils and cup shaped objects?,a) Forging,b) Rolling,c) Deep drawing,d) Wire drawing,c,"Explanation: Deep drawing process is also known as cup drawing, which is a part of sheet metal forming process. It is widely used for making products like utensils, cup shaped objects, pressure vessels, gas cylinders, cans etc. In this method, a blank is placed on a die cavity and then held in a position using a holding plate and pressed against the die cavity by using a punch."
Question 407,8. Which of the following methods of heat treatment is best suitable for treating the output of cold rolling?,a) Quenching,b) Case hardening,c) Annealing,d) Cyanide hardening,c,"Explanation: The plastic deformation of metal plate in cold rolling includes changing of grain shape, increase in dislocation density and strain hardening of the material. These changes make the metal plate hard and ductile less. So, annealing is a process of heat treatment in which material regains its softness and relieves all its residual stresses. "
Question 408,5. Which of the following processes of metal forming is best suited for making products like aircraft wings and window frames?,a) Forging,b) Rolling,c) Drawing,d) Stretch forming,d,"Explanation: Stretch forming is a sheet metal forming process in which the sheet metal is clamped at the edges and stretched by using the dies or form blocks. And no any lubrication is required significantly during the process. This method is best suited for making the products like aircraft wings, window frames, automobile door panels etc."
Question 409,1. Which of the following types of stresses is applied during the process of rod or tube drawing?,a) Shear,b) Direct compressive,c) Tensile,d) In-direct compressive,c,"Explanation: Rod or tube drawing is a deformation process in which the metallic material in the form of cylindrical bar is pulled by the help of a converging die. In general, the tensile stress is applied during the process. The strain hardening occurs which makes the material very hard and strong by reducing its ductility."
Question 410,3. Which of the following processes of metal forming is widely used for making the raw material for the manufacturing of bolts?,a) Rolling,b) Forging,c) Wire drawing,d) Rod drawing,d,"Explanation: Rod drawing is not completely similar to wire drawing process. Wire drawing is basically a metal forming process which is used for producing wires like electrical wires, cables, welding electrodes, fencing etc. And rod drawing is used for making the raw material for the manufacturing of bolts. The basic difference between rod drawing and wire drawing is the size of the metallic bar used for wire drawing is small."
Question 411,1. Low carbon steels can be started to forge at what temperature?,a) 1140°C,b) 1270°C,c) 1350°C,d) 1420°C,b,"Explanation: Low carbon soft steels are generally used for making seamless and welded steel pipes, which can be used at very low temperatures. They can be forged at a temperature range of 1250°C to 1300°C. "
Question 412,2. Low carbon steels get forged at what temperature?,a) 670°C,b) 730°C,c) 820°C,d) 950°C,c,Explanation: None.
Question 413,3. At what temperature does the high carbon steel get forged?,a) 950°C,b) 1510°C,c) 1150°C,d) 1290°C,c,"Explanation: The high carbon steel is provided heat treatment, after this, the steel is allowed to quench and then tempered. They can be forged at a temperature of 1100°C. "
Question 414,4. At what temperature does alloy steel get forged?,a) 850°C,b) 970°C,c) 1050°C,d) 1200°C,a,"Explanation: For the improvisation of mechanical and physical properties of the materials, a variety of materials are added and to make it an alloying steel. The temperature at which alloy steel can be forged is in the range of 825°C to 875°C. "
Question 415,5. At what temperature does wrought irons get forged?,a) Below 1000°C,b) Below 1100°C,c) Below 1200°C,d) Below 1300°C,d,Explanation: Wrought irons are identified as alloys of iron which contain very low amount of carbon in them. Wrought irons can be forged at a temperature below 1300°C. 
Question 416,6. What is the forging temperature of brass?,a) 450°C,b) 500°C,c) 550°C,d) 600°C,d,"Explanation: Brass is an alloy of mainly two metals being, copper and zinc. These two metals can substitute each other’s place in the structure of the alloy. The temperature at which brass gets forged is about 600oC. "
Question 417,7. What is the forging temperature of bronze?,a) 850°C,b) 900°C,c) 950°C,d) 1000°C,c,"Explanation: Bronze is an alloy which essentially contains copper in it and generally is found to contain about 12% of tin. It may also have some other additives in it like, manganese, zinc or nickel. The temperature at which bronze gets forged is about 950°C. "
Question 418,8. What is the forging temperature of magnesium alloys?,a) 450°C,b) 500°C,c) 550°C,d) 600°C,b,"Explanation: Metals such as zinc, copper, zirconium, silicon or aluminium are mixed with magnesium to form a magnesium alloy. In terms of structure, magnesium is considered to be the lightest metal. The temperature at which magnesium alloys get forged is 500°C. "
Question 419,1. Which of the following operations involves reduction in length?,a) Upsetting,b) Drawing down,c) Setting down,d) Punching,a,"Explanation: There are a few operations, which are needed for a change of shape of the raw material to its finished form. This can be achieved using smith forging operation. Upsetting is one such operation that involves reduction in length for an increase the thickness. "
Question 420,2. Swaging is another name for which smith forging operation?,a) Bending,b) Punching,c) Drawing down,d) Cutting,c,"Explanation: Swaging is another name for the operation drawing down. In drawing down operation, the length of the material is found to increase at an expense of the width or thickness of it. "
Question 421,3. Which of the following operations involves reduction in length?,a) Upsetting,b) Drawing down,c) Setting down,d) Punching,b,"Explanation: There are a few operations, which are needed for a change of shape of the raw material to its finished form. This can be achieved using smith forging operation. Drawing down is one such operation that involves increase in length at the cost of its thickness. "
Question 422,4. Which of the following material is not used as a flux in forge welding?,a) 2 parts of borax with one part of sal-ammoniac,b) Quartz sand,c) Calcined borax,d) 3 parts of borax with one part of sal-ammoniac,a,"Explanation: The metal which has to be welded, has to be first covered with flux. By covering it with flux, it cuts the metal from the air around and prevents from oxidation. The fluxes used for this purpose are quartz sand, calcined borax and 3 parts of borax with one part of sal-ammoniac. "
Question 423,"5. In which form of weld, are the ends joined?",a) Lap weld,b) Butt weld,c) Jump weld,d) Split weld,a,"Explanation: In lap weld, the ends of the two metals which are to be joined are prepared for welding. In butt welding, the materials are butted are together. In split weld, the metals are kept like a fork in a ‘V’ shape. "
Question 424,6. Which form of weld is also called as ‘T’ weld?,a) Lap weld,b) Butt weld,c) Jump weld,d) Split weld,c,"Explanation: In butt welding, the materials are butted are together. In jump welding, the two pieces are kept at an angle of 90o, in the form of an inverted ‘T’. "
Question 425,"7. In cutting smith forging operation, up to what temperature is the steel heated?",a) 700°C – 800°C,b) 850°C – 950°C,c) 900°C – 1000°C,d) 1000°C – 1100°C,b,"Explanation: Cutting is a form of smith forging operation, it is a form of chiseling. For chiseling, a long piece of metal is cut into equal lengths. These equal lengths need to be heated till they are cherry red hot, which makes it a temperature of 850°C to 950°C. "
Question 426,8. Which form of weld is also called as ‘V’ weld?,a) Lap weld,b) Butt weld,c) Jump weld,d) Split weld,d,"Explanation: In butt welding, the materials are butted are together. In split weld, the metals are kept like a fork in a ‘V’ shape. "
Question 427,"1. In compressed impression die forging, what is typically the shape of the solid blanks?",a) Cylindrical,b) Conical,c) Spherical,d) Pyramidal,a,"Explanation: In compressed impression die forging, it is generally observed that the shape of solid blanks is either cylindrical or prismatic only. The shape of the solid blanks is similar even in case of stamping industry. "
Question 428,2. Which of the following is not an operation of impression die forging?,a) Broaching,b) Quenching,c) Bending,d) Spreading,b,"Explanation: There are many basic and primary operations in impression die forging, a few of them are, broaching, bending, spreading, sizing and swaging. But, quenching is not any of the operation of impression die forging. "
Question 429,3. Which of the following is not produced using impression die forging?,a) Levers,b) Handles,c) Gears,d) Turbine blades,b,"Explanation: Impression die forging finds itself into variety of applications. They are used in making a few automobile parts also. Among the following, levers, gears and turbine blades can be produced using impression die forging, but not handles. "
Question 430,4. Which of the following are not operated in impression die forging?,a) Hammers,b) Presses,c) Tongs,d) Special purpose machines,c,"Explanation: In impression die forging, there are various such articles which can be forged, but after that need a little working on it. To accomplish that, hammers, presses and some other special purpose machining tools are employed. A tong is not one of them. "
Question 431,"5. In forging dies, what is the maximum degree to which the drafts are made?",a) 7o,b) 10o,c) 13o,d) 18o,b,"Explanation: In impression die forging, there has to be some amount of allowance given to the process, like machining allowance and draft allowance. The drafts are made with a maximum degree deviation of 10o. "
Question 432,"6. In forging dies, what is the minimum degree to which the drafts are made?",a) 1o,b) 2o,c) 3o,d) 4o,c,"Explanation: There are some types of allowances which have to be given to the system before the operations begin, like, shrinkage allowance, machining allowance and draft allowance. The minimum angle which can be given to the drafts is only 3o. "
Question 433,7. What is the minimum temperature given before hot forging?,a) 100°C,b) 150°C,c) 200°C,d) 250°C,c,"Explanation: Hot forging is a method of forging articles at an extremely high temperature. But, before putting the article into the hot forging processes, it has to be heated to certain temperatures. The minimum temperature that has to be given to the article should be 200°C. "
Question 434,8. What is the maximum temperature that can should be given before hot forging process?,a) 150°C,b) 200°C,c) 250°C,d) 300°C,d,"Explanation: In impression die forging, when any article has to be hot forged, it has to first be heated to bring at a certain temperature. The maximum temperature that can be provided for hot forging is 300°C. "
Question 435,1. Which of the following is not included in weldability?,a) Ability of mechanical soundness,b) Serviceability of joint,c) Strain relieving brittleness,d) Metallurgical compatibility of metal,c,"Explanation: For the making of good fabricated composition of a structure, metal with good weldability gets readily welded. Weldability includes ability of the metal or the alloy to be having a soundness in its mechanical properties, metallurgical compatibility of metal and serviceability of joint. "
Question 436,2. Which effect is not seen in alloys on weldability?,a) Control of ductile-malleable transformation temperature,b) Provision for oxidation to molten metal,c) Reduction in segregation,d) Grain refinement,b,"Explanation: On weldability, there are some effects seen in the alloying elements. Some of them are, Control of ductile-malleable transformation temperature, Reduction in segregation, Grain refinement and provision for deoxidation to the molten metal. "
Question 437,"3. On which of the following factor, does weldability not depend?",a) Boiling point,b) Melting point,c) Thermal expansion,d) Thermal conductivity,a,"Explanation: Weldability is dependent on five factors of the metal or alloying element. The factors being, melting point, thermal expansion, thermal conductivity, surface condition and change in the microstructure. "
