Question Name,Question,Option A,Option B,Option C,Option D,Answer,Explanation
Question 370,"2. If two surfaces are at the same temperature, then the conditions correspond to mobile thermal equilibrium for which the resultant interchange of heat is zero are",a) 3 E – _ E B = 0,b) 2 E – _ E B = 0,c) E – _ E B = 0,d) _ E – _ E B = 0,c,Explanation: The remainder (1 – _) will be reflected back for full absorption at the black surface. 
Question 371,3. The absorptivity of black body equals to,a) 2,b) 1,c) 3,d) 4,b,Explanation: The absorptivity of black body equals to unity. 
Question 372,4. A diathermanous body,a) Shines as a result of incident radiation,b) Gets heated up a result of absorption of incident radiation,c) Allows all the incident radiation to pass through it,d) Partly absorbs and partly reflects the incident radiation,c,Explanation: It behaves like a body that allows all the incident radiation to pass through it. 
Question 373,5. Choose the false statement,a) Snow is nearly black to thermal radiation,b) Absorption of radiation occurs in a very thin layer of material near the surface,c) Transmissivity varies with the wavelength of incident radiation,"d) Most of the engineering materials have rough surfaces, and these rough surfaces give regular (specular) reflections",d,Explanation: Rough surfaces give diffused reflections. Reflections from highly polished and smooth surfaces have regular characteristics. 
Question 374,6. The emissivity and the absorptivity of a real surface are equal for radiation with identical temperature and wavelength. This law is referred to as,a) Kirchhoff’s law,b) Lambert’s law,c) Planck’s law,d) Wein’s displacement law,a,Explanation: Emissivity and absorptivity are related by Kirchhoff’s law. 
Question 375,"7. With an increase in wavelength, the monochromatic emissive power of a black body",a) Increases,b) Decreases,"c) Decreases, reaches a minimum and then increases","d) Increases, reaches a maximum and then decreases",d,Explanation: It firstly increases to its maximum value and then decreases to zero. 
Question 376,8. The temperature of a solid surface changes from 27 K to 627 K. The emissive power changes would then confirm to the ratio,a) 6:1,b) 9:1,c) 81:1,d) 27:1,c,Explanation: E2/E1 = (T2/T1)4 = 81. 
Question 377,"9. If the temperature of a hot body is increased by 50%, the amount of radiations emitted by it would increase by nearly",a) 200%,b) 500%,c) 50%,d) 100%,b,Explanation: E2/E1 = (T2/T1)4 = 5.06. 
Question 378,"1. Consider two bodies, one absolutely back and the other non-black and let these be at same temperature. Which one of the following statement is correct?",a) Black body radiates less intensively than a non-black body,b) Non-black body radiates less intensively than a black body,c) Both will radiates equally,d) None of them will radiates,b,Explanation: The radiation spectrum for a non-black body may be similar or radically different from that of a black body. 
Question 379,"2. When Stefan-Boltzmann law is applied to a black body, it takes the form",a) E = _ T,b) E = _ T 2,c) E = _ T 3,d) E = _ T 4,d,Explanation: The constant is different for different bodies. 
Question 380,"3. When the emissivity of non-black surface is constant at all temperatures and throughout the entire range of wavelength, the surface is called",a) Gray body,b) Transparent body,c) Opaque bodies,d) Perfect black body,a,"Explanation: The radiation spectrum for a grey body, though reduced in vertical scale, is continuous and identical to the corresponding curve for a perfectly black surface. "
Question 381,4. The emissivity of the gray surface may be expressed as,a) _ /2 _ b,b) _ / 3 _ b,c) _ / _ b,d) _ _ / _ b,c,Explanation: It is the ratio of radiating coefficient to that of black body radiating coefficient. 
Question 382,"5. If a black body at 1000 K and a gray body at 1250 K emit the same amount of radiation, what should be the emissivity of the gray body?",a) 0.3096,b) 0.4096,c) 0.5096,d) 0.6096,b,Explanation: E = (T b/T G) 4 = 0.4096. 
Question 383,6. The radiant heat transfer from a plate of 2.5 cm2 area at 1250 K to a very cold enclosure is 5.0 W. Determine the emissivity of the plate at this temperature,a) 0.444,b) 0.344,c) 0.244,d) 0.144,d,Explanation: Emissivity = E/_ A T4 = 0.144. 
Question 384,"7. A 100 W light bulb has a tungsten filament (emissivity = 0.30) which is required to operate at 2780 K. If the bulb is completely evacuated, calculate the minimum surface area of the tungsten filament",a) 0.98 * 10 -4 m2,b) 1.98 * 10 -4 m2,c) 2.98 * 10 -4 m2,d) 3.98 * 10 -4 m2,a,"Explanation: E = (Emissivity) _ A T4. So, A = 0.98 * 10 -4 m2. "
Question 385,9. For a hemisphere solid angle is measured as,a) Radian and its maximum value is π,b) Degree and its maximum value is 180 degree,c) Steradian and its maximum value is 2π,d) Steradian and its maximum value is π,d,Explanation: It should be measured in Steradian. 
Question 386,10. A gray body (E = 0.8) emits the same amount of heat as a black body at 1075 K. Find out the required temperature of the gray body,a) 1146.72 K,b) 1136.72 K,c) 1126.72 K,d) 1116.72 K,b,Explanation: T b4 = E T g4. 
Question 387,"1. The solid angle is defined by a region by the rays of a sphere, and is measured as",a) An/r 2,b) An/r,c) An/r 3,d) An/r 4,a,"Explanation: Solid angle is represented by _. Where, An is projection of incident surface normal to line of propagation. "
Question 388,"2. The plane angle is defined by a region by the rays of a circle, and is measured as",a) 3 L/ r,b) 2 L/ r,c) L/ r,d) 4 L / r,c,Explanation: It is the ratio of arc of length on the circle to the radius of the circle. Where L is the arc of length and r is the radius of the circle.
Question 389,"3. When the incident surface is a sphere, the projection of surface normal to the line of propagation is the silhouette disk of the sphere which is a circle of the diameter of",a) Parabola,b) Sphere,c) Triangle,d) Hyperbola,b,Explanation: It must be a circle of a diameter of a sphere. 
Question 390,"4. If I n denotes the normal intensity and I _ represents the intensity at angle _, then",a) I _ = 2 I n cos _,b) I _ = 3 I n cos _,c) I _ = 4 I n cos _,d) I _ = I n cos _,d,Explanation: The intensity of radiation in a direction from the normal is proportional to cosine of the angle. 
Question 391,5. The intensity of normal radiation I n is how much times the emissive power?,a) 1/π,b) 2/ π,c) 3/ π,d) 4/ π,a,Explanation: I n = _ T 4/ π and E = _ T 4. 
Question 392,"7. Consider a deep-space probe constructed as 1 m diameter polished aluminum sphere. Estimate the equilibrium temperature that the probe reaches if the solar energy received is 300 W/m2. For solar radiation, absorptivity of aluminum is 0.3 and the average emissivity appropriate for aluminum at low temperature is 0.04",a) 415.67 K,b) 315.67 K,c) 215.67 K,d) 115.67 K,b,Explanation: Q in = _ q A P = 70.7 W. Q out = E _ b A T 4.
Question 393,8. The total emissive power of the emitter with area d A and temperature T is given by,a) E = 2 _ T 4 d A,b) E = 3 _ T 4 d A,c) E = _ T 4 d A,d) E = _ _ T 4 d A,c,Explanation: E = I n π d A. 
Question 394,9. A black body of 0.2 m2 area has an effective temperature of 800 K. Calculate the intensity of normal radiations,a) 1234.65 W/m2 sr,b) 7396.28 W/m2 sr,c) 3476.74 W/m2 sr,d) 8739.43 W/m2 sr,b,Explanation: In = _ T 4/π = 7396.28 W/m2 sr. 
Question 395,10. The energy radiated out decreases with increases in _ and becomes zero at an angle of,a) 45,b) 30,c) 0,d) 90,d,Explanation: I _ = I n cos _. So at 90 degree it becomes zero. 
Question 396,1. The heat energy absorbed by a known area in a fixed time is determined with the help of an instrument called,a) Psychrometer,b) Pyrheliometer,c) Thermometric well,d) Any instrument,b,Explanation: The effects of absorption by the atmosphere are eliminated by finding the value of the solar constant at various altitudes of the sun on the same day. 
Question 397,"2. The observed solar constant S0, the true solar constant S and the angular elevation Z of the sun are related by the expression",a) S0 =S a SEC Z,b) S0 =2 S a SEC Z,c) S0 =3 S a SEC Z,d) S0 =4 S a SEC Z,a,"Explanation: From the straight line graph between log S0 along y-axis and sec Z along x-axis, the intercept log S on the y-axis is found."
Question 398,3. The value of solar constant varies between,a) 1123 and 1237 W/m2,b) 1345 and 1453 W/m2,c) 1987 and 2346 W/m2,d) 1335 and 1815 W/m2,d,"Explanation: When the sun lies at a mean distance from the earth, the heat flux from the sun to the outer edge of the atmosphere has been found to be 1350 W/m2. "
Question 399,4. The total amount of heat energy received by the sphere of radius r is,a) 2 π R2 S,b) 6 π R2 S,c) 4 π R2 S,d) π R2 S,c,Explanation: Area of sphere is 4 π R2. 
Question 400,5. Amount of heat energy radiated by unit surface of the sun in the same time workout as,"Take, R = mean distance of earth from the sun and r = radius of sun",a) E = π R2 S/4 π R2,b) E = 4 π R2 S/4 π R2,c) E = 4 π R2,b,Explanation: It is the ratio of 4 π R2 S to 4 π R2. 
Question 401,6. Temperature of sun can be workout from,a) Wein’s displacement law,b) Stefan-Boltzmann law,c) Kirchhoff’s law,d) All of the Mentioned,a,Explanation: (Wavelength) MAX T = 2-89 * 10 -3 m K. 
Question 402,"7. The temperature of the photosphere, referred to as the effective temperature of the sun, is usually taken as",a) 3000 K,b) 4000 K,c) 5000 K,d) 6000 K,d,Explanation: The sun consists of a central hot portion surrounded by the photosphere. 
Question 403,8. The approximate distribution of the flow of sun’s energy to the earth’s surface is,a) 53% is reflected back to space,b) 53% is transmitted to the earth,c) 9% is scattered,d) 22% is absorbed in the atmosphere,c,"Explanation: 33% is reflected back to space, 15% is absorbed in the atmosphere and 43% is transmitted to the earth. "
Question 404,9. The solar radiation that is felt at the earth’s surface includes,(i) Direct radiation that has passed through the atmosphere,(ii) Diffuse radiation from the sky,(iii) Absorbed radiation from the water,Identify the correct statement,b,Explanation: Option (iii) must be reflected radiation from water. 
Question 405,"10. When the sun lies at a mean distance from the earth, the heat flux from the sun to the outer edge of the atmosphere has been found to be",a) 2350 W/m2,b) 3350 W/m2,c) 4350 W/m2,d) 1350 W/m2,d,Explanation: 47% of this would reach the earth’s surface. 
Question 406,1. Which one is having the highest value of solar absorptivity?,a) White marble,b) Concrete,c) Asphalt,d) Snow,c,"Explanation: Solar absorptivity for asphalt is 0.90 while that of white marble, concrete and snow are 0.46, 0.60 and 0.28 respectively. "
Question 407,2. What is the value of solar absorptivity for aluminum foil?,a) 0.15,b) 0.16,c) 0.17,d) 0.18,a,"Explanation: Solar absorptivity doesn’t require a medium and for aluminum, it reaches maximum efficiency in a vacuum. "
Question 408,3. What is the value of solar absorptivity for polished copper?,a) 0.17,b) 0.18,c) 0.19,d) 0.20,b,Explanation: Solar absorptivity for polished copper depends on the frequency and wavelength of the radiation. 
Question 409,4. Which one is having the lowest value of solar absorptivity?,a) Snow,b) Red brick,c) Aluminum foil,d) Polished aluminum,d,"Explanation: Solar absorptivity for polished aluminum is 0.09 while that of red brick, aluminum foil and snow are 0.63, 0.15 and 0.28 respectively."
Question 410,5. What is the value of solar absorptivity for polished stainless steel?,a) 0.37,b) 0.36,c) 0.35,d) 0.34,a,Explanation: There is vibration within the molecules and it can potentially initiate electromagnetic waves. 
Question 411,6. Which one is having the lowest value of solar absorptivity?,a) Black paint,b) Dull stainless steel,c) Concrete,d) White marble,d,"Explanation: Solar absorptivity for white marble is 0.46 while that of black paint, dull stainless steel and concrete are 0.97, 0.50 and 0.60 respectively."
Question 412,7. What is the value of solar absorptivity for white marble?,a) 0.45,b) 0.46,c) 0.47,d) 0.48,b,Explanation: It generates and receives electromagnetic waves at the expense of its stored energy. 
Question 413,8. Which one is having the highest value of solar absorptivity?,a) Red brick,b) Asphalt,c) Black paint,d) White paint,c,"Explanation: Emissivity of black paint is 0.97 while that of red brick, asphalt and white paint are 0.63, 0.90 and 0.14 respectively. "
Question 414,9. What is the value of solar absorptivity for asphalt?,a) 0.90,b) 0.80,c) 0.70,d) 0.60,a,Explanation: Energy emitted by asphalt is not continuous but is in the form of quanta. 
Question 415,10. What is the value of solar absorptivity for snow?,a) 0.25,b) 0.26,c) 0.27,d) 0.28,d,Explanation: Solar absorptivity for snow varies on the nature of its surface and its temperature. 
Question 416,"1. Engineering problems of practical interest are involved with heat exchange between two or more surfaces, and this exchange is strongly dependent upon",(i) Radiative properties,(ii) Temperature levels,(iii) Surface geometrics,Identify the correct statements,d,"Explanation: For black surface, it is necessary to determine what portion of radiation emitted by one will be intercepted by the other. "
Question 417,2. The fraction of the radiative energy that is diffused from one surface element and strikes the other surface directly with no intervening reflections is called,(i) Radiation shape factor,(ii) Geometrical factor,(iii) Configuration factor,Choose the correct answer,c,"Explanation: Radiation shape factor, geometrical factor and configuration factor are all same. "
Question 418,3. The interchange factor is also known as,a) Equivalent emissivity,b) Irradiation,c) Radiosity,d) Shape factor,a,Explanation: The interchange factor is also known as equivalent emissivity. 
Question 419,"4. For the same type of shapes, the value of the radiation shape factor will be higher when",a) Surfaces are closer,b) Surfaces are larger and held closer,c) Surfaces are moved further apart,d) Surfaces are smaller and held closer,b,Explanation: Obviously the value of radiation shape factor will be higher when surfaces are larger and held closer. 
Question 420,"5. A thin shield of emissivity E 3 on both sides is placed between two infinite parallel plates of emissivities E 1 and E    2 and temperatures T 1 and T 2. If E 1 = E 2 = E 3, then the fraction radiant energy transfer without shield takes the value",a) 0.25,b) 0.50,c) 0.75,d) 1.25,b,"Explanation: The ratio of radiant energy transfer without and with shield is given by(1/E 1 + 1/E 2 – 1)/ [(1/E 1 + 1/E 3 – 1) + (1/E 3 + 1/E 2 – 1)]. "
Question 421,6. The grey body shape factor for radiant heat exchange between a small body (emissivity = 0.4) in a large enclosure (emissivity = 0.5) is,a) 0.1,b) 0.2,c) 0.4,d) 0.5,c,Explanation: (F) 12 = 1/ (1 – E 1 + 1 + 0). 
Question 422,"7. Two long parallel surfaces, each of emissivity 0.7 are at different temperatures and accordingly have radiation exchange between them. It is desired to reduce 75% of this radiant heat transfer by inserting thin parallel shields of equal emissivity 0.7 on both sides. What should be the number of shields?",a) 2,b) 4,c) 1,d) 3,d,Explanation: Without shields/with shield = 1/N + 1. 
Question 423,"8. An enclosure consists of four surfaces 1, 2, 3 and 4. The view factors for radiation heat transfers are",F 11 = 0.1,F 12 = 0.4,F 13 = 0.25,The surface areas A 1 and A 2 are 4 m2 and 2 m2. The view factor F 41 is,a,Explanation: F 11 + F 12 + F 13 + F 14 = 1. 
Question 424,9. The value of shape factor depends on how many factors?,a) 4,b) 1,c) 2,d) 3,c,Explanation: Geometry and orientation. 
Question 425,1. Which of the following is a wrong statement according to the shape factor is equal to one?,a) For any surface completely enclosed by another surface,b) For infinite parallel planes radiating only to each other,c) For a flat or convex surface with respect to itself,d) Inside cylinder to outer cylinder of a long co-axial cylinder,d,"Explanation: For a flat or convex surface, the shape factor with respect to itself is zero. This aspect stems from the fact that for any part of flat or convex surface, one cannot see any other part of the same surface. "
Question 426,3. The reciprocity theorem states that,a) F 12 = F 21,b) A 1 F 12 = A 2 F 21,c) A 1 F 21 = A 2 F 12,d) A 2 F 21 = A 1 F 12,b,Explanation: It indicates the net radiation exchange can be calculated by computing one way configuration factor from either surface to the other.
Question 427,4. Two radiating surface A 1 = 6 m2 and A 2 = 4 m2 have shape factor F 12 = 0.1. Then the shape factor F 21 will be,a) 0.12,b) 0.18,c) 0.15,d) 0.10,c,Explanation: A 1 F 12 = A 2 F 21. 
Question 428,5. What is the value of shape factor for two infinite parallel surfaces separated by a distance x?,a) 0,b) 1,c) x,d) Infinity,b,Explanation: All the radiation emitted by one falls on the other so shape factor is unity. 
Question 429,7. What is the shape factor of hemispherical surface closed by a plane surface of diameter d?,a) 0,b) 1.5,c) 1,d) 0.5,d,"Explanation: F 11 + F 12 = 1 and F 21 = 1. Therefore, F 11 = 0.5. "
Question 430,9. What is the shape factor for a hemispherical bowl with respect to itself of diameter d? The cavity is closed on its outer surface with a flat plate,a) 1.5,b) 1,c) 0.5,d) 2.5,c,Explanation: F 11 = 1 – A 2 / A 1 = 0.5. 
Question 431,"2. A large plane, perfectly insulated on one face and maintained at a fixed temperature T 1 on the bare face, has an emissivity of 0.84 and loses 250 W/m2 when exposed to surroundings at nearly 0 K. The radiant heat loss from another plane of the same size is 125 W/m2 when bare face having emissivity 0.42 and is maintained at temperature T 2 is exposed to the same surroundings. Subsequently these two planes are brought together so that the parallel bare faces lie only 1 cm apart and the heat supply to each is so regulated that their respective temperatures T    1 and T 2 remains unchanged. Determine he net heat flux between the planes",a) 0,b) 1,c) 2,d) 3,a,"Explanation: Q 12 = F 12 A 1 _ b (T 14 – T 24). Since T    1 = T 2, we get Q 12/A1 = 0. "
Question 432,3. Interchange factor for body 1 completely enclosed by body 2 (body 1 is large) is given by,a) 2/ [1/E 1 + A1/A2 (1/E 2 – 1)].,b) 1/ [1/E 1 + A1/A2 (1/E 2 – 1)].,c) 4/ [1/E 1 + A1/A2 (1/E 2 – 1)].,d) 3/ [1/E 1 + A1/A2 (1/E 2 – 1)].,b,Explanation: This is the interchange factor for the radiation from surface 1 to surface 2. 
Question 433,"4. A thermos flask has a double walled bottle and the space between the walls is evacuated so as to reduce the heat flow. The bottle surfaces are silver plated and the emissivity of each surface is 0.025. If the contents of the bottle are at 375 K, find the rate of heat loss from the thermos bottle to the ambient air at 300 K",a) 5.38 W,b) 6.38 W,c) 7.38 W,d) 8.38 W,d,Explanation: Q 12 = F 12 A 1 _ b (T 14 – T 24). F 12 = 1/ (1/E 1 + 1/E2 – 1) = 0.01266. 
Question 434,"5. A 250 mm by 250 mm ingot casting, 1.5 m high and at 1225 K temperature, is stripped from its mold. The casting is made to stand on end on the floor of a large foundry whose wall, floor and roof can be assumed to be at 300 K temperature. Make calculation for the rate of radiant heat interchange between the casting and the room. The casting material has an emissivity of 0.85",a) 161120 W,b) 171120 W,c) 181120 W,d) 191120 W,b,Explanation: Q 12 = F 12 A 1 _ b (T 14 – T 24). F 12 = 0.85 and A 1 = (0.25)2 + 4(1.5) (0.25) = 1.5625 m2. 
Question 435,6. Interchange factor for infinitely long concentric cylinders is given by,a) 1/ [A1/A2 (1/E 2 – 1)].,b) [1/E 1 + A1/A2 (1/E 2 – 1)].,c) 2/ [1/E 1 + A1/A2 (1/E 2 – 1)].,d) 1/ [1/E 1 + A1/A2 (1/E 2 – 1)].,d,Explanation: This is the interchange factor for the radiation from surface 1 to surface 2. 
Question 436,7. What is the geometric factor for infinitely long concentric cylinders?,a) 1,b) 0.5,c) 0.33,d) 0.75,a,Explanation: The inner cylinder is completely enclosed by the outer cylinder and as such the entire heat radiations emitted by the emitted by the inner cylinder are intercepted by the outer cylinder. 
Question 437,8. What is the geometric factor for concentric spheres?,a) 0.85,b) 0.33,c) 1,d) 0.95,c,Explanation: The inner sphere is completely enclosed by the outer sphere and as such the entire heat radiations emitted by the emitted by the inner sphere are intercepted by the outer cylinder. 
Question 438,9. The net heat interchange between non-black bodies at temperature T 1 and T 2 is given by,a) f 12 F 12 _ (T 14 – T 24),b) f 12 F 12 A 1 _ (T 14 – T 24),c) f 12 A 1 _ (T 14 – T 24),d)  F 12 A 1 _ (T 14 – T 24),b,Explanation: The factor f 12 is called the interchanging factor from surface 1 to surface 2. 
Question 439,10. A thermos flask has a double walled bottle and the space between the walls is evacuated so as to reduce the heat flow. The bottle surfaces are silver plated and the emissivity of each surface is 0.025. If the contents of the bottle are at 375 K and temperature of ambient air is 300 K. What thickness of cork (k = 0.03 W/m degree) would be required if the same insulating effect is to be achieved by the use of cork?,a) 26.8 cm,b) 25.8 cm,c) 24.8 cm,d) 23.8 cm,a,"Explanation: Q = k A (t 1 – t 2)/_. So, _ = 0.268 m = 26.8 cm. "
Question 440,1. The total radiant energy leaving a surface per unit time per unit surface area is represented by,a) Radiation,b) Radiosity,c) Irradiation,d) Interchange factor,b,Explanation: It comprises the original emittance from the surface plus the reflected portion of any radiation incident upon it. 
Question 441,"2. Determine the radiant heat flux between two closely spaced, black parallel plates radiating only to each other if their temperatures are 850 K and 425 K. The plates have an area of 4 m2",a) .040,b) .030,c) .020,d) .010,d,Explanation: Q 12 = F 12 A 1 _ b (T 14 – T 24) = .010. 
Question 442,3. What is the value of grey body factor for concentric cylinders?,a) 3/ [1 – e 1/e 1 + 1 + 1 – e 2/e 2 (A 1/A 2)].,b) 4/ [1 – e 1/e 1 + 1 + 1 – e 2/e 2 (A 1/A 2)].,c) 1/ [1 – e 1/e 1 + 1 + 1 – e 2/e 2 (A 1/A 2)].,d) 2/ [1 – e 1/e 1 + 1 + 1 – e 2/e 2 (A 1/A 2)].,c,"Explanation: Here, F 12 = 1. "
Question 443,4. The net heat exchange between the two grey surfaces may be written as,a) (Q 12) NET = E b 1 – E b 2/ (1 – e 1/A 1 e 1 + 1/A 1 F    12 + 1 – e 2/A 2 e 2),b) (Q 12) NET = 2 E b 1 – E b 2/ (1 – e 1/A 1 e 1 + 1/A 1 F    12 + 1 – e 2/A 2 e 2),c) (Q 12) NET = E b 1 – 2 E b 2/ (1 – e 1/A 1 e 1 + 1/A 1 F    12 + 1 – e 2/A 2 e 2),d) (Q 12) NET = 2 E b 1 – 3 E b 2/ (1 – e 1/A 1 e 1 + 1/A 1 F    12 + 1 – e 2/A 2 e 2),a,Explanation: This equation gives the electrical network corresponding to surface resistances of two radiating bodies. 
Question 444,5. The net rate at which the radiation leaves the surface is given by,a) e (E b – J)/1 – 4 e,b) e (E b – J)/1 – 3 e,c) e (E b – J)/1 – 2 e,d) e (E b – J)/1 – e,d,Explanation: The net rate at which the radiation leaves the surface is given by the difference between its radiosity and the incoming irradiation.
Question 445,6. A ring (E = 0.85) of 8 cm inner and 16 cm outer diameter is placed in a horizontal plane. A small element (E = 0.7) of 1 cm2 is placed concentrically 8 cm vertically below the center of the ring. The temperature of the ring is 800 K and that of small area is 400 K. Find the radiant heat gain by the small ring,a) – 10.59 J/hour,b) – 11.59 J/hour,c) – 12.59 J/hour,d) – 13.59 J/hour,b,Explanation: Q 12 = (F g) 12 A 1 _ b (T 14 – T 24) = A    1 _ b (T 14 – T 24)/ (I/E 1 – 1) + 1/F 12 + (I/E 2 – 1) A 2/A 1. 
Question 446,"7. Two opposed, parallel, infinite planes are maintained at 420 K and 480 K. Calculate the net heat flux between these planes if one has an emissivity of 0.8 and other an emissivity of 0.7",a) 534.86 W/m2,b) 634.86 W/m2,c) 734.86 W/m2,d) 834.86 W/m2,c,Explanation: Q 12 = (F g) 12 A 1 _ b (T 14 – T 24) and (F g) 12 = 1/ (I/E 1 – 1) + 1/F 12 + (I/E 2 – 1) A 2/A 1. 
Question 447,"8. Consider the above problem, if temperature difference is doubled by raising the temperature 480 K to 540 K, then how this heat flux will be affected?",a) 1803.55 W/m2,b) 1703.55 W/m2,c) 1603.55 W/m2,d) 1503.55 W/m2,a,Explanation: Q 2 = 0.59 (5.67 * 10 -8) (540 4 – 420 4). 
Question 448,9. The total radiant energy incident upon a surface per unit time per unit area is known as,a) Shape factor,b) Radiosity,c) Radiation,d) Irradiation,d,Explanation: Some of it may be reflected to become a part of the radiosity of the surface. 
Question 449,10. Which one of the following is true for the opaque non-black surface?,a) J = E +2 p G,b) J = E + p G,c) J = 2 E + p G,d) J = _ E + p G,b,"Explanation: For an opaque non-black surface of constant radiation characteristics, the total radiant energy leaving the surface is the sum of its original emittance and the energy reflected by it out of the irradiation impinging on it. "
Question 450,1. A radiation shield should,a) Have high transmissivity,b) Absorb all the radiations,c) Have high reflexive power,d) Partly absorb and partly transmit the incident radiation,c,Explanation: Reflexive power is much high for radiation shield. 
Question 451,2. Radiation shield are used between the emitting surfaces such that,a) To reduce overall heat transfer,b) To increase overall heat transfer,c) To increase density,d) To reduce density,a,Explanation: Many situations are encountered where it is desired to reduce the overall heat transfer between two radiating surfaces. 
